Authors,Title,Year,Source title,Volume,Issue,Art. No.,Page start,Page end,Page count,Cited by,DOI,Link,Document Type,Source,EID
"Zhu, Y., Zheng, G., Dong, Z., Liu, G.P.","Design of supervisory software for ethernet-based control systems",2007,"2007 IEEE International Conference on Networking, Sensing and Control, ICNSC'07",,, 4238960,"36","41",,,10.1109/ICNSC.2007.372929,"https://www.scopus.com/inward/record.uri?eid=2-s2.0-34748905311&doi=10.1109%2fICNSC.2007.372929&partnerID=40&md5=d4313c73436329139ab743bfd81bfce9",Conference Paper,Scopus,2-s2.0-34748905311
"Jiang, Z.-P., Liu, J.-X., Huang, L., Luo, X.-S.","Research progress and problems of the C4ISR architecture",2007,"Xi Tong Gong Cheng Yu Dian Zi Ji Shu/Systems Engineering and Electronics","29","10",,"1677","1682",,1,,"https://www.scopus.com/inward/record.uri?eid=2-s2.0-36249028811&partnerID=40&md5=80aa0a1104b3374d6862257a9814d080",Review,Scopus,2-s2.0-36249028811
"Medioni, G., François, A.R.J., Siddiqui, M., Kim, K., Yoon, H.","Robust real-time vision for a personal service robot",2007,"Computer Vision and Image Understanding","108","1-2",,"196","203",,29,10.1016/j.cviu.2006.10.015,"https://www.scopus.com/inward/record.uri?eid=2-s2.0-34548221824&doi=10.1016%2fj.cviu.2006.10.015&partnerID=40&md5=322a2c0ed68406adfff83d5ddae962f1",Article,Scopus,2-s2.0-34548221824
"Katsuno, A., Tsuchiya, S., Adachi, M.","TRIOLE organic computing architecture",2007,"Fujitsu Scientific and Technical Journal","43","4",,"412","419",,5,,"https://www.scopus.com/inward/record.uri?eid=2-s2.0-36048968174&partnerID=40&md5=9cc5ecc257ac1d6a8569a2c6dd6dd599",Article,Scopus,2-s2.0-36048968174
"Bozzon, A., Brambilla, M., Fraternali, P., Speroni, P., Toffetti, G.","Applying Web-based networking protocols and software architectures for providing adaptivity, personalization, and remotization features to industrial human machine interface applications",2007,"Proceedings - International Conference on Advanced Information Networking and Applications, AINA",,, 4220992,"940","947",,,10.1109/AINA.2007.39,"https://www.scopus.com/inward/record.uri?eid=2-s2.0-34548707569&doi=10.1109%2fAINA.2007.39&partnerID=40&md5=8facd522980e5939f29ef9f220a13fce",Conference Paper,Scopus,2-s2.0-34548707569
"Grundy, J., Hosking, J.","Supporting generic sketching-based input of diagrams in a domain-specific visual language meta-tool",2007,"Proceedings - International Conference on Software Engineering",,, 4222590,"282","291",,26,10.1109/ICSE.2007.81,"https://www.scopus.com/inward/record.uri?eid=2-s2.0-34548781878&doi=10.1109%2fICSE.2007.81&partnerID=40&md5=6e0bc840436f8fec55a6be0066021efa",Conference Paper,Scopus,2-s2.0-34548781878
"Ferrari, R., Madhavji, N.H.","The impact of requirements knowledge and experience on software architecting: An empirical study",2007,"2007 Working IEEE/IFIP Conference on Software Architecture (WICSA'07)",,, 4077033,"","",,6,10.1109/WICSA.2007.42,"https://www.scopus.com/inward/record.uri?eid=2-s2.0-34547156646&doi=10.1109%2fWICSA.2007.42&partnerID=40&md5=e478ded623ff29c283aa199cf272a57f",Conference Paper,Scopus,2-s2.0-34547156646
"Hanna, P., O'Neill, I., Wootton, C., McTear, M.","Promoting extension and reuse in a spoken dialog manager: An evaluation of the queen's communicator",2007,"ACM Transactions on Speech and Language Processing","4","3", 1255173,"","",,4,10.1145/1255171.1255173,"https://www.scopus.com/inward/record.uri?eid=2-s2.0-34547239167&doi=10.1145%2f1255171.1255173&partnerID=40&md5=515d267623ec5dd3e3eadb6117d3ec85",Article,Scopus,2-s2.0-34547239167
"Carrabino, D., D'Onorio De Meo, P., Sanna, N., Castrignanò, T., Orsini, M., Floris, M., Tramontano, A.","The mepsMAP server. Mapping epitopes on protein surface: Mining annotated proteins",2007,"IEEE Transactions on Nanobioscience","6","2",,"155","161",,,10.1109/TNB.2007.897488,"https://www.scopus.com/inward/record.uri?eid=2-s2.0-34250029242&doi=10.1109%2fTNB.2007.897488&partnerID=40&md5=e9bcec81a115b05f3fad27516947f8ad",Article,Scopus,2-s2.0-34250029242
"Roden, T.E., Parberry, I., Ducrest, D.","Toward mobile entertainment: A paradigm for narrative-based audio only games",2007,"Science of Computer Programming","67","1",,"76","90",,8,10.1016/j.scico.2006.07.004,"https://www.scopus.com/inward/record.uri?eid=2-s2.0-34249934337&doi=10.1016%2fj.scico.2006.07.004&partnerID=40&md5=55c616002bbc45976308fff1babc5879",Article,Scopus,2-s2.0-34249934337
"McLaughlin, L.","Currents: Universal Business Language: Checkup time for an XML vision",2007,"IEEE Software","24","3",,"113","117",,,10.1109/MS.2007.69,"https://www.scopus.com/inward/record.uri?eid=2-s2.0-34248361597&doi=10.1109%2fMS.2007.69&partnerID=40&md5=f1ac83fd85f7c7b78ec8a1f14a6e3981",Article,Scopus,2-s2.0-34248361597
"Cartmell, J., Krstajic, D., Leahy, D.E.","Competitive workflow: Novel software architecture for automating drug design",2007,"Current Opinion in Drug Discovery and Development","10","3",,"347","352",,12,,"https://www.scopus.com/inward/record.uri?eid=2-s2.0-34249108530&partnerID=40&md5=700f61b20d29a9c98d19947f59104ad2",Review,Scopus,2-s2.0-34249108530
"Jiao, S., Li, J., Li, Y., He, Z.","Development of SCADA/HMI for FECS in fuel power plant with characteristics of process control",2007,"Dianli Xitong Zidonghua/Automation of Electric Power Systems","31","8",,"80","84",,1,,"https://www.scopus.com/inward/record.uri?eid=2-s2.0-34249335020&partnerID=40&md5=9a86137f98f088524f02af465eeefef9",Article,Scopus,2-s2.0-34249335020
"Guo, P., Chen, J., Wang, Y., Li, D., Sun, S.","Frame and implementation of EMC diagnosis expert system",2007,"Journal of Computational Information Systems","3","4",,"1685","1690",,,,"https://www.scopus.com/inward/record.uri?eid=2-s2.0-34250717070&partnerID=40&md5=c55a2d5be512aa069999b3e18ebfbd18",Article,Scopus,2-s2.0-34250717070
"Rafla, T., Robillard, P.N., Desmarais, M.","A method to elicit architecturally sensitive usability requirements: Its integration into a software development process",2007,"Software Quality Journal","15","2",,"117","133",,11,10.1007/s11219-006-9009-9,"https://www.scopus.com/inward/record.uri?eid=2-s2.0-33947672867&doi=10.1007%2fs11219-006-9009-9&partnerID=40&md5=0bdee99a98aa780056ac577bd24566b8",Article,Scopus,2-s2.0-33947672867
"Folmer, E., Bosch, J.","Cost effective development of usable systems: Gaps between HCI and software architecture design",2006,"Advances in Information Systems Development: Bridging the Gap Between Academia and Industry","1",,,"337","348",,1,10.1007/978-0-387-36402-5_29,"https://www.scopus.com/inward/record.uri?eid=2-s2.0-84889577258&doi=10.1007%2f978-0-387-36402-5_29&partnerID=40&md5=63bbcc1647b9486fd492eac07202d6df",Conference Paper,Scopus,2-s2.0-84889577258
"Kim, S., Choi, J., Kim, M.","Interactive software architecture for service robots",2006,"2006 SICE-ICASE International Joint Conference",,, 4108263,"4270","4275",,,10.1109/SICE.2006.314873,"https://www.scopus.com/inward/record.uri?eid=2-s2.0-34250694971&doi=10.1109%2fSICE.2006.314873&partnerID=40&md5=67a3015c8ad0add02cfcc98e02e38254",Conference Paper,Scopus,2-s2.0-34250694971
"Nehmer, J., Becker, M., Karshmer, A., Lamm, R.","Living assistance systems - An ambient intelligence approach -",2006,"Proceedings - International Conference on Software Engineering","2006",,,"43","50",,151,,"https://www.scopus.com/inward/record.uri?eid=2-s2.0-34247106132&partnerID=40&md5=92ae0d278985eb8a55c7223617a5526a",Conference Paper,Scopus,2-s2.0-34247106132
"Mitsunaga, N., Miyashita, T., Ishiguro, H., Kogure, K., Hagita, N.","Robovie-IV: A communication robot interacting with people daily in an office",2006,"IEEE International Conference on Intelligent Robots and Systems",,, 4059225,"5066","5072",,39,10.1109/IROS.2006.282594,"https://www.scopus.com/inward/record.uri?eid=2-s2.0-34250613163&doi=10.1109%2fIROS.2006.282594&partnerID=40&md5=6f9f367a36200ab8b9e730287b390c09",Conference Paper,Scopus,2-s2.0-34250613163
"Aycard, O., Spalanzani, A., Yguel, M., Burlet, J., Du Lac, N., De La Fortelle, A., Fraichard, T., Ghorayeb, H., Kais, M., Laugier, C., Laurgeau, C., Michel, G., Raulo, D., Steux, B.","PUVAME - New French approach for vulnerable road users safety",2006,"IEEE Intelligent Vehicles Symposium, Proceedings",,, 1689596,"2","7",,9,,"https://www.scopus.com/inward/record.uri?eid=2-s2.0-34547286451&partnerID=40&md5=54b96a0bef3fe12abb2edca660c1455c",Conference Paper,Scopus,2-s2.0-34547286451
"Prats, M., Del Pobil, A.P., Sanz, P.J.","A control architecture for compliant execution of manipulation tasks",2006,"IEEE International Conference on Intelligent Robots and Systems",,, 4059120,"4472","4477",,1,10.1109/IROS.2006.282083,"https://www.scopus.com/inward/record.uri?eid=2-s2.0-34250677786&doi=10.1109%2fIROS.2006.282083&partnerID=40&md5=a50ef1bac011c0b58f6bd3405278c541",Conference Paper,Scopus,2-s2.0-34250677786
"Maximilien, E.M.","Semantic Web services for human activities",2006,"Proceedings - 2006 IEEE International Conference on Services Computing, SCC 2006",,, 4026899,"11","18",,,10.1109/SCC.2006.87,"https://www.scopus.com/inward/record.uri?eid=2-s2.0-35148837312&doi=10.1109%2fSCC.2006.87&partnerID=40&md5=c54006d265787b9e446f168ca53d49b7",Conference Paper,Scopus,2-s2.0-35148837312
"Doswell, J.T.","Context-aware mobile augmented reality architecture for lifelong learning",2006,"Proceedings - Sixth International Conference on Advanced Learning Technologies, ICALT 2006","2006",, 1652448,"372","374",,5,,"https://www.scopus.com/inward/record.uri?eid=2-s2.0-34247142479&partnerID=40&md5=9dbe3dd21b79505da99192cde59c798b",Conference Paper,Scopus,2-s2.0-34247142479
"Yan, M.-T., Huang, C.-W., Wang, C.-J.","Development of an open architecture CNC system for a wire-EDM machine",2006,"Materials Science Forum","505-507","PART 1",,"481","486",,4,,"https://www.scopus.com/inward/record.uri?eid=2-s2.0-35348839584&partnerID=40&md5=7bd6c015ec55f47575b20a7a62bc9e2d",Conference Paper,Scopus,2-s2.0-35348839584
"Karow, M., Gehlert, A., Becker, J., Esswein, W.","On the transition from computation independent to platform independent models",2006,"Association for Information Systems - 12th Americas Conference On Information Systems, AMCIS 2006","6",,,"3901","3909",,1,,"https://www.scopus.com/inward/record.uri?eid=2-s2.0-84870380197&partnerID=40&md5=973c81ae8340a8dd2f93de896a36e882",Conference Paper,Scopus,2-s2.0-84870380197
"Johnston, M.D., Rabe, K.J.","Integrating AI planning for telepresence with time delays",2006,"AAAI Fall Symposium - Technical Report","FS-06-07",,,"43","49",,,,"https://www.scopus.com/inward/record.uri?eid=2-s2.0-33947216603&partnerID=40&md5=9433e1263239759ba61fd954434db380",Conference Paper,Scopus,2-s2.0-33947216603
"Doswell, J.T., Blake, M.B., Butcher-Green, J.","Mobile augmented reality system architecture for ubiquitous e-learning",2006,"Proceedings - Fourth IEEE International Workshop on Wireless, Mobile and Ubiquitous Technology in Education, WMUTE 2006",,, 4032535,"121","123",,8,10.1109/WMTE.2006.261358,"https://www.scopus.com/inward/record.uri?eid=2-s2.0-38949111693&doi=10.1109%2fWMTE.2006.261358&partnerID=40&md5=e8eee6b355f8b3cc85d3fa8283ab48da",Conference Paper,Scopus,2-s2.0-38949111693
"Folmer, E., Van Welie, M., Bosch, J.","Bridging patterns: An approach to bridge gaps between SE and HCI",2006,"Information and Software Technology","48","2",,"69","89",,35,10.1016/j.infsof.2005.02.005,"https://www.scopus.com/inward/record.uri?eid=2-s2.0-28844501942&doi=10.1016%2fj.infsof.2005.02.005&partnerID=40&md5=92f7d15897699d67daef17764456a73c",Article,Scopus,2-s2.0-28844501942
[No author name available],"Software Composition: 5th International Symposium, SC 2006 Vienna, Austria, March 25-26, 2006 Revised Papers",2006,"Lecture Notes in Computer Science (including subseries Lecture Notes in Artificial Intelligence and Lecture Notes in Bioinformatics)","4089 LNCS",,,"","",338,,,"https://www.scopus.com/inward/record.uri?eid=2-s2.0-84941152108&partnerID=40&md5=7de9a9a43856344be4f770c4b5896523",Conference Review,Scopus,2-s2.0-84941152108
"Holger, K., Johan, E., Angelos, A., Luisa, A.","Software architecture for an adaptive integrated automotive HMI",2006,"13th World Congress on Intelligent Transport Systems and Services",,,,"","",,1,,"https://www.scopus.com/inward/record.uri?eid=2-s2.0-84950168844&partnerID=40&md5=cab0ce8663d7bb73ef0634b911c5333e",Conference Paper,Scopus,2-s2.0-84950168844
"Roden, T., Parberry, I.","Designing a narrative-based audio only 3D game engine",2005,"ACM International Conference Proceeding Series","265",,,"274","277",,5,10.1145/1178477.1178525,"https://www.scopus.com/inward/record.uri?eid=2-s2.0-77953500890&doi=10.1145%2f1178477.1178525&partnerID=40&md5=82b430ddeda4418128008c41f3ca98f4",Conference Paper,Scopus,2-s2.0-77953500890
"Diehl, S.","Software visualization",2005,"Proceedings - 27th International Conference on Software Engineering, ICSE05",,,,"718","719",,10,,"https://www.scopus.com/inward/record.uri?eid=2-s2.0-28044467459&partnerID=40&md5=935f999643e432962d4f5e71a696203f",Conference Paper,Scopus,2-s2.0-28044467459
[No author name available],"Proceedings: Third International Conference on Information Technology and Applications",2005,"Proceedings - 3rd International Conference on Information Technology and Applications, ICITA 2005","I",,,"","",814,,,"https://www.scopus.com/inward/record.uri?eid=2-s2.0-33646815993&partnerID=40&md5=6577eed4e711e4d4a17ba7e514a898a2",Conference Review,Scopus,2-s2.0-33646815993
"Lai, A.M., Starren, J.B., Shea, S., IDEATel Consortium","Architecture for remote training of home telemedicine patients.",2005,"AMIA ... Annual Symposium proceedings / AMIA Symposium. AMIA Symposium",,,,"1015","",,2,,"https://www.scopus.com/inward/record.uri?eid=2-s2.0-39049175167&partnerID=40&md5=5745a73a149b120972912147afcdb196",Article,Scopus,2-s2.0-39049175167
[No author name available],"11th IEEE International Software Metrics Symposium",2005,"Proceedings - International Software Metrics Symposium","2005",,,"","",423,,,"https://www.scopus.com/inward/record.uri?eid=2-s2.0-33749033637&partnerID=40&md5=5a4a4fe279751d0313df1584c85597fe",Conference Review,Scopus,2-s2.0-33749033637
"Berti, S., Paternò, F.","Migratory multimodal interfaces in multidevice environments",2005,"Proceedings of the Seventh International Conference on Multimodal Interfaces, ICMI'05",,,,"92","99",,18,10.1145/1088463.1088481,"https://www.scopus.com/inward/record.uri?eid=2-s2.0-32344436932&doi=10.1145%2f1088463.1088481&partnerID=40&md5=cee00092eec4d15f409448e4d8b3b048",Conference Paper,Scopus,2-s2.0-32344436932
"Barralon, N., Nguyen, V.-T., Rey, G.","Techniques de couplage de bureaux: Ambient-desktop comme illustration",2005,"ACM International Conference Proceeding Series","120",,,"193","200",,1,10.1145/1102613.1102652,"https://www.scopus.com/inward/record.uri?eid=2-s2.0-77953923522&doi=10.1145%2f1102613.1102652&partnerID=40&md5=eef820c0318d151498ea6d20f67595ff",Conference Paper,Scopus,2-s2.0-77953923522
"Olsen, D.R., Klemmer, S.R.","The future of user interface design tools",2005,"Conference on Human Factors in Computing Systems - Proceedings",,,,"2134","2135",,3,10.1145/1056808.1057124,"https://www.scopus.com/inward/record.uri?eid=2-s2.0-84869121629&doi=10.1145%2f1056808.1057124&partnerID=40&md5=947e759e3d7607645f7d985f4f23e3c3",Conference Paper,Scopus,2-s2.0-84869121629
[No author name available],"2005 IEEE Symposium on Visual Languages and Human-centric Computing",2005,"Proceedings - 2005 IEEE Symposium on Visual Languages and Human-Centric Computing","2005",,,"","",361,,,"https://www.scopus.com/inward/record.uri?eid=2-s2.0-33746439802&partnerID=40&md5=4fdaa5046a224c109a1f9b6024db467c",Conference Review,Scopus,2-s2.0-33746439802
"Zeng, D., Xie, C., Li, X.","Design and implementation of Internet based healthcare robot system",2005,"Annual International Conference of the IEEE Engineering in Medicine and Biology - Proceedings","7 VOLS",, 1616478,"577","580",,3,,"https://www.scopus.com/inward/record.uri?eid=2-s2.0-33846910019&partnerID=40&md5=9a8d453db5245b1746e8acc6c0f2f94a",Conference Paper,Scopus,2-s2.0-33846910019
"Schraft, R.D., Meyer, C., Parlitz, C., Helms, E.","PowerMate - A safe and intuitive robot assistant for handling and assembly tasks",2005,"Proceedings - IEEE International Conference on Robotics and Automation","2005",, 1570745,"4074","4077",,30,10.1109/ROBOT.2005.1570745,"https://www.scopus.com/inward/record.uri?eid=2-s2.0-33846152916&doi=10.1109%2fROBOT.2005.1570745&partnerID=40&md5=5f299b57c5f2fe8d80e59adfa9b17c22",Conference Paper,Scopus,2-s2.0-33846152916
"Chanu, A., Martel, S., Beaudoin, G.","Real-time magnetic resonance gradient-based propulsion of a wireless microdevice using pre-acquired roadmap and dedicated software architecture",2005,"Annual International Conference of the IEEE Engineering in Medicine and Biology - Proceedings","7 VOLS",, 1615647,"5190","5193",,4,,"https://www.scopus.com/inward/record.uri?eid=2-s2.0-33846934199&partnerID=40&md5=00fd8308335c5752971766513970cfd1",Conference Paper,Scopus,2-s2.0-33846934199
"Hummel, K.A., Jochum, W., Leitich, S., Schandl, B.","Supporting meetings with a goal-driven service-oriented multimedia environment",2005,"MSC 2005 - Proceedings of the 1st ACM International Workshop on Multimedia Service Composition, co-located with ACM Multimedia 2005",,,,"55","64",,1,10.1145/1099423.1099434,"https://www.scopus.com/inward/record.uri?eid=2-s2.0-38149071968&doi=10.1145%2f1099423.1099434&partnerID=40&md5=14ff587fb035bc488a05488c6acc20e0",Conference Paper,Scopus,2-s2.0-38149071968
"Zhu, Y.-C., Di, Y.-Q., Quan, H.-D., Fan, S.-Y., Sun, S.-Y.","Simulation training system of general radar equipment and key technology",2005,"Xitong Fangzhen Xuebao / Journal of System Simulation","17","11",,"","",,2,,"https://www.scopus.com/inward/record.uri?eid=2-s2.0-27944463665&partnerID=40&md5=3c5b7a5b8c004c166368910aed5b8ccf",Article,Scopus,2-s2.0-27944463665
"Stellato, S., Romani, E.","Ground Segment simulator: A tool for mission design and life cycle management",2005,"European Space Agency, (Special Publication) ESA SP",,"602",,"461","463",,,,"https://www.scopus.com/inward/record.uri?eid=2-s2.0-26944435845&partnerID=40&md5=b8c045f00ff55a037b81c995875653d0",Conference Paper,Scopus,2-s2.0-26944435845
[No author name available],"Engineering Human Computer Interaction and Interactive Systems: Joint Working Conferences EHCI-DSVIS 2004",2005,"Lecture Notes in Computer Science","3425",,,"","",409,,,"https://www.scopus.com/inward/record.uri?eid=2-s2.0-24344508227&partnerID=40&md5=ed875f531e8014d213dcf0065f3decce",Conference Review,Scopus,2-s2.0-24344508227
"Hoffman, D., Grivel, E., Battle, L.","Designing software architectures to facilitate accessible Web applications",2005,"IBM Systems Journal","44","3",,"467","483",,14,,"https://www.scopus.com/inward/record.uri?eid=2-s2.0-23744470357&partnerID=40&md5=92d1c79ab0dff98244d3e24a9bca169f",Article,Scopus,2-s2.0-23744470357
"Sandor, C., Klinker, G.","A rapid prototyping software infrastructure for user interfaces in ubiquitous augmented reality",2005,"Personal and Ubiquitous Computing","9","3",,"169","185",,26,10.1007/s00779-004-0328-1,"https://www.scopus.com/inward/record.uri?eid=2-s2.0-19744372431&doi=10.1007%2fs00779-004-0328-1&partnerID=40&md5=5019cbea791759e472ef3113de3b3cfe",Article,Scopus,2-s2.0-19744372431
"Bulis, K.D., DiStefano III, J.J.","W 3MCSim: An online and reconfigurable Monte Carlo simulator for interactive probabilistic/statistical modeling",2005,"Computer Methods and Programs in Biomedicine","77","1",,"71","79",,1,10.1016/j.cmpb.2004.08.001,"https://www.scopus.com/inward/record.uri?eid=2-s2.0-11344252458&doi=10.1016%2fj.cmpb.2004.08.001&partnerID=40&md5=4582e3f21bfb0bda1ac8b7f1b97c6524",Article,Scopus,2-s2.0-11344252458
"Corteggiano, F., Matteoda, R., Moitre, D., Magnago, F.","Software architecture for deregulated electric markets",2004,"2004 IEEE Power Engineering Society General Meeting","1",,,"141","145",,6,,"https://www.scopus.com/inward/record.uri?eid=2-s2.0-13244296947&partnerID=40&md5=c7e2903d7170633113168a7db7eb2490",Conference Paper,Scopus,2-s2.0-13244296947
"Zhang, K., Su, J.","RTOS-based software architecture for multisensor fusion system",2004,"2004 5th Asian Control Conference","2",,,"906","913",,4,,"https://www.scopus.com/inward/record.uri?eid=2-s2.0-16244400811&partnerID=40&md5=ea2edb0ad09ad20a0db9bc2adf442543",Conference Paper,Scopus,2-s2.0-16244400811
"Malik, A.S., Guo, R.-M.","Hardware and software architecture and functions for reliable level-2 plus systems in multiple mill operations",2004,"AISTech - Iron and Steel Technology Conference Proceedings","2",,,"331","338",,,,"https://www.scopus.com/inward/record.uri?eid=2-s2.0-18044395920&partnerID=40&md5=a94d16d0f2192abae10e9bbac0a4094a",Conference Paper,Scopus,2-s2.0-18044395920
"Chen, Y., Wang, T., Wei, H., Cao, Y.","Machine tool controller based on MC/OS- II",2004,"Progress of Machining Technology - Proceedings of the Seventh International Conference on Progress of Machining Technology, ICPMT'2004",,,,"551","554",,2,,"https://www.scopus.com/inward/record.uri?eid=2-s2.0-15544381084&partnerID=40&md5=0f657908d72f1696c1017d5fe56ffd88",Conference Paper,Scopus,2-s2.0-15544381084
"Doswell, J.T.","Pedagogical embodied conversational agent",2004,"Proceedings - IEEE International Conference on Advanced Learning Technologies, ICALT 2004",,,,"774","776",,7,10.1109/ICALT.2004.1357653,"https://www.scopus.com/inward/record.uri?eid=2-s2.0-13244264866&doi=10.1109%2fICALT.2004.1357653&partnerID=40&md5=fa7dd63734b65410f45312e4cc1cb108",Conference Paper,Scopus,2-s2.0-13244264866
"Rey, G., Coutaz, J.","Contextor: Capture and dynamic distribution of contextual information [Le contexteur: Capture et distribution dynamique d'information contextuelle]",2004,"ACM International Conference Proceeding Series","64",,,"131","138",,1,10.1145/1050873.1050902,"https://www.scopus.com/inward/record.uri?eid=2-s2.0-77952903294&doi=10.1145%2f1050873.1050902&partnerID=40&md5=46ac75e5289482bcd53aa9ddf22885a9",Conference Paper,Scopus,2-s2.0-77952903294
[No author name available],"Interaction between Humans and Autonomous Systems over Extended Operation - Papers from the 2004 AAAI Spring Symposium, Technical Report",2004,"AAAI Spring Symposium - Technical Report","3",,,"","",153,,,"https://www.scopus.com/inward/record.uri?eid=2-s2.0-22344433456&partnerID=40&md5=cf775e5dbafb76b194a7b7b4f6061c99",Conference Review,Scopus,2-s2.0-22344433456
"Böhlen, M., Tan, N.","A patient autonomous knowledge sharing system for outdoor public spaces",2004,"AAAI Spring Symposium - Technical Report","3",,,"17","22",,1,,"https://www.scopus.com/inward/record.uri?eid=2-s2.0-22344449808&partnerID=40&md5=166d826d78e2ff3bf67f5c506dfa0574",Conference Paper,Scopus,2-s2.0-22344449808
"Pinheiro, V., Furtado, E., Furtado, V.","A unified architecture to develop interactive knowledge based systems",2004,"Lecture Notes in Computer Science (including subseries Lecture Notes in Artificial Intelligence and Lecture Notes in Bioinformatics)","3171",,,"174","183",,6,,"https://www.scopus.com/inward/record.uri?eid=2-s2.0-35048875330&partnerID=40&md5=e63da77db3de87999b3d651b9ff12911",Article,Scopus,2-s2.0-35048875330
"Koukoulidis, V., Shah, M.","The IP multimedia domain in wireless networks: Concepts, architecture, protocols and applications",2004,"Proceedings - IEEE Sixth International Symposium on Multimedia Software Engineering, MSE 2004",,,,"484","490",,2,10.1109/MMSE.2004.81,"https://www.scopus.com/inward/record.uri?eid=2-s2.0-20844434517&doi=10.1109%2fMMSE.2004.81&partnerID=40&md5=3aa766e0bd47bcb24fbcfedac577b337",Conference Paper,Scopus,2-s2.0-20844434517
"Repo, P.","Facilitating user interface adaptation to mobile devices",2004,"ACM International Conference Proceeding Series","82",,,"433","436",,2,10.1145/1028014.1028088,"https://www.scopus.com/inward/record.uri?eid=2-s2.0-77952993355&doi=10.1145%2f1028014.1028088&partnerID=40&md5=edaeac7174aad23a5cfe8ea7ea24e5e4",Conference Paper,Scopus,2-s2.0-77952993355
"Ratcliffe, O., Cîmpan, S., Oquendo, F., Scibile, L.","Formalization of an HCI style for accelerator restart monitoring",2004,"Lecture Notes in Computer Science (including subseries Lecture Notes in Artificial Intelligence and Lecture Notes in Bioinformatics)","3047",,,"167","181",,1,,"https://www.scopus.com/inward/record.uri?eid=2-s2.0-35048844296&partnerID=40&md5=af883cb35788e139ba1dd1ffff86a177",Article,Scopus,2-s2.0-35048844296
"Bennasri, S., Souveyet, C.","Capturing requirements variability into components: A goal driven approach",2004,"ICEIS 2004 - Proceedings of the Sixth International Conference on Enterprise Information Systems",,,,"438","443",,4,,"https://www.scopus.com/inward/record.uri?eid=2-s2.0-8444244490&partnerID=40&md5=a336f154d8b268db876889344e912f56",Conference Paper,Scopus,2-s2.0-8444244490
"Karacor, M., Ozdemir, E.","Mobile phone-based SCADA automation",2004,"Measurement and Control","37","9",,"268","272",,1,,"https://www.scopus.com/inward/record.uri?eid=2-s2.0-9144274688&partnerID=40&md5=c9218297fb7b74acfb9dbd0a016ac76c",Review,Scopus,2-s2.0-9144274688
"Bainbridge, D.","Music information retrieval research and its context at the University of Waikato",2004,"Journal of the American Society for Information Science and Technology","55","12",,"1092","1099",,1,10.1002/asi.20062,"https://www.scopus.com/inward/record.uri?eid=2-s2.0-4744375537&doi=10.1002%2fasi.20062&partnerID=40&md5=fdf24a0419fe6b71d04b3fde93d2c265",Article,Scopus,2-s2.0-4744375537
"Korhonen, I., Bardram, J.E.","Introduction to the special section on pervasive healthcare",2004,"IEEE Transactions on Information Technology in Biomedicine","8","3",,"229","234",,47,10.1109/TITB.2004.835337,"https://www.scopus.com/inward/record.uri?eid=2-s2.0-16544376812&doi=10.1109%2fTITB.2004.835337&partnerID=40&md5=dcbbc29c382819b6c8ce1e618147e885",Editorial,Scopus,2-s2.0-16544376812
