Item Title,Publication Title,Book Series Title,Journal Volume,Journal Issue,Item DOI,Authors,Publication Year,URL,Content Type
"Towards a Code of Ethics for Gamification at Enterprise","The Practice of Enterprise Modeling","","","","10.1007/978-3-662-45501-2_17","Alimohammad ShahriMahmood HosseiniKeith PhalpJacqui TaylorRaian Ali","2014","http://link.springer.com/chapter/10.1007/978-3-662-45501-2_17","Chapter"
"Submitted for: The Seventh IAASS Conference – Space Safety is no Accident","Space Safety is No Accident","","","","10.1007/978-3-319-15982-9_29","Dr Andy QuinnAmaya Atencia YepezMichael KlickerDiane HowardAlberto Del BiancoChristophe ChavagnacCarolynne Campbell","2015","http://link.springer.com/chapter/10.1007/978-3-319-15982-9_29","Chapter"
"Classification and Qualitative Analysis of Non-Functional Requirements Approaches","Enterprise, Business-Process and Information Systems Modeling","","","","10.1007/978-3-662-43745-2_24","M. Mahmudul HasanPericles LoucopoulosMara Nikolaidou","2014","http://link.springer.com/chapter/10.1007/978-3-662-43745-2_24","Chapter"
"Hybrid Distributed Computing Service Based on the DIRAC Interware","Data Analytics and Management in Data Intensive Domains","","","","10.1007/978-3-319-57135-5_8","Victor GergelVladimir KorenkovIgor PelevanyukMatvey SapunovAndrei TsaregorodtsevPetr Zrelov","2017","http://link.springer.com/chapter/10.1007/978-3-319-57135-5_8","Chapter"
"Ground Truth Acquisition of Humanoid Soccer Robot Behaviour","RoboCup 2013: Robot World Cup XVII","","","","10.1007/978-3-662-44468-9_50","Andrea PennisiDomenico D. BloisiLuca IocchiDaniele Nardi","2014","http://link.springer.com/chapter/10.1007/978-3-662-44468-9_50","Chapter"
"A Unified Description Language for the Internet of Services","Towards the Internet of Services: The THESEUS Research Program","","","","10.1007/978-3-319-06755-1_34","Daniel Oberle","2014","http://link.springer.com/chapter/10.1007/978-3-319-06755-1_34","Chapter"
"Simulation and HRI Recent Perspectives with the MORSE Simulator","Simulation, Modeling, and Programming for Autonomous Robots","","","","10.1007/978-3-319-11900-7_2","Séverin LemaignanMarc HanheideMichael KargHarmish KhambhaitaLars KunzeFlorian LierIngo LütkebohleGrégoire Milliez","2014","http://link.springer.com/chapter/10.1007/978-3-319-11900-7_2","Chapter"
"QueFaire: Context-Aware in-Person Social Activity Recommendation System for Active Aging","Inclusive Smart Cities and e-Health","","","","10.1007/978-3-319-19312-0_6","Victor PonceJean-Pierre DeschampsLouis-Philippe GirouxFarzad SalehiBessam Abdulrazak","2015","http://link.springer.com/chapter/10.1007/978-3-319-19312-0_6","Chapter"
"Interactive RGB-D SLAM on Mobile Devices","Computer Vision - ACCV 2014 Workshops","","","","10.1007/978-3-319-16634-6_25","Nicholas BrunettoNicola FioraioLuigi Di Stefano","2015","http://link.springer.com/chapter/10.1007/978-3-319-16634-6_25","Chapter"
"A Generic and Scalable IoT Data Fusion Infrastructure","Internet of Things (IoT) in 5G Mobile Technologies","","","","10.1007/978-3-319-30913-2_13","Vangelis NomikosIoannis PriggourisGeorge BismpikisStathes HadjiefthymiadesOdysseas Sekkas","2016","http://link.springer.com/chapter/10.1007/978-3-319-30913-2_13","Chapter"
"Assistive E-Health Platform for Permanent Monitoring","ICTs for Improving Patients Rehabilitation Research Techniques","","","","10.1007/978-3-662-48645-0_4","Sebastian FuicuAndrei AvramescuDiana LascuRoxana PadurariuMarius Marcu","2015","http://link.springer.com/chapter/10.1007/978-3-662-48645-0_4","Chapter"
"Human-Agent Knowledge Cartography for e-Science: NASA Field Trials at the Mars Desert Research Station","Knowledge Cartography","","","","10.1007/978-1-4471-6470-8_17","Maarten SierhuisSimon J. Buckingham Shum","2014","http://link.springer.com/chapter/10.1007/978-1-4471-6470-8_17","Chapter"
"The Journey: A Service-Based Adaptive Serious Game on Probability","Games and Learning Alliance","","","","10.1007/978-3-319-22960-7_10","Maira B. CarvalhoFrancesco BellottiRiccardo BertaFrancesco CuratelliAlessandro De GloriaGiorgia GazzarataJun HuMichael Kickmeier-RustChiara Martinengo","2015","http://link.springer.com/chapter/10.1007/978-3-319-22960-7_10","Chapter"
"A Data Set for Fault Detection Research on Component-Based Robotic Systems","Towards Autonomous Robotic Systems","","","","10.1007/978-3-319-40379-3_35","Johannes WienkeSebastian Meyer zu BorgsenSebastian Wrede","2016","http://link.springer.com/chapter/10.1007/978-3-319-40379-3_35","Chapter"
"On Chinese Online P2P Lender’s Model Building on the Macro, Micro and Industry Level","Design, User Experience, and Usability: Design Discourse","","","","10.1007/978-3-319-20886-2_30","Qiwei Liang","2015","http://link.springer.com/chapter/10.1007/978-3-319-20886-2_30","Chapter"
"Toward a user-guided manipulation framework for high-DOF robots with limited communication","Intelligent Service Robotics","","7","3","10.1007/s11370-014-0156-8","Calder Phillips-GrafflinNicholas AlunniHalit Bener SuayJim MainpriceDaniel LofaroDmitry BerensonSonia ChernovaRobert W. LindemanPaul Oh","2014","http://link.springer.com/article/10.1007/s11370-014-0156-8","Article"
"Enabling Wearable Soft Tactile Displays with Electroactive Smart Elastomers","Haptics: Perception, Devices, Control, and Applications","","","","10.1007/978-3-319-42324-1_32","Gabriele FredianiHugh BoysStefan PosladFederico Carpi","2016","http://link.springer.com/chapter/10.1007/978-3-319-42324-1_32","Chapter"
"From Small Seeds Grow Fruitful Trees: How the PHelpS Peer Help System Stimulated a Diverse and Innovative Research Agenda over 15 Years","International Journal of Artificial Intelligence in Education","","26","1","10.1007/s40593-015-0073-9","J. VassilevaG. I. McCallaJ. E. Greer","2016","http://link.springer.com/article/10.1007/s40593-015-0073-9","Article"
"Model-Driven Approach for Early Power-Aware Design Space Exploration of Embedded Systems","Journal of Signal Processing Systems","","87","3","10.1007/s11265-016-1144-3","Feriel Ben AbdallahChiraz TrabelsiRabie Ben AtitallahMourad Abed","2017","http://link.springer.com/article/10.1007/s11265-016-1144-3","Article"
"An Iterative Approach towards Interactive Digital Narrative – Early Results with the Advanced Stories Authoring and Presentation System","New Horizons in Web Based Learning","","","","10.1007/978-3-662-43454-3_7","Hartmut Koenitz","2014","http://link.springer.com/chapter/10.1007/978-3-662-43454-3_7","Chapter"
"Collaboration Across Professional Boundaries – The Emergence of Interpretation Drift and the Collective Creation of Project Jargon","Computer Supported Cooperative Work (CSCW)","","24","4","10.1007/s10606-015-9229-2","Mika Yasuoka","2015","http://link.springer.com/article/10.1007/s10606-015-9229-2","Article"
"Infrastructures to Engineer Open Agent Environments by Means of Electronic Institutions","Agent Environments for Multi-Agent Systems IV","","","","10.1007/978-3-319-23850-0_14","Dave de JongeJuan A. Rodriguez-AguilarBruno Rosell i GuiCarles Sierra","2015","http://link.springer.com/chapter/10.1007/978-3-319-23850-0_14","Chapter"
"A Failure-Tolerant Approach for Autonomous Mobile Manipulation in RoboCup@Work","RoboCup 2015: Robot World Cup XIX","","","","10.1007/978-3-319-29339-4_8","Jan CarstensenTorben CarstensenSimon AdenAndrej DickJens HübnerSven KrauseAlexander MichailikJohann WiggerJan FriederichsJens Kotlarski","2015","http://link.springer.com/chapter/10.1007/978-3-319-29339-4_8","Chapter"
"Persuasive Technology in Mobile Applications Promoting Physical Activity: a Systematic Review","Journal of Medical Systems","","40","3","10.1007/s10916-015-0425-x","John MatthewsKhin Than WinHarri Oinas-KukkonenMark Freeman","2016","http://link.springer.com/article/10.1007/s10916-015-0425-x","Article"
"Robot Unit Testing","Simulation, Modeling, and Programming for Autonomous Robots","","","","10.1007/978-3-319-11900-7_22","Andreas BihlmaierHeinz Wörn","2014","http://link.springer.com/chapter/10.1007/978-3-319-11900-7_22","Chapter"
"Practical Assessment of Energy-Based Sensing through Software Defined Radio Devices","Technological Innovation for Collective Awareness Systems","","","","10.1007/978-3-642-54734-8_58","Miguel DuarteAntonio FurtadoM. LuisLuis BernardoRui DinisRodolfo Oliveira","2014","http://link.springer.com/chapter/10.1007/978-3-642-54734-8_58","Chapter"
"Introduction","Design Issues for Service Delivery Platforms","","","","10.1007/978-3-658-10541-9_1","Dr. Martin Bergaus","2015","http://link.springer.com/chapter/10.1007/978-3-658-10541-9_1","Chapter"
"Development of an Ecosystem for Ambient Assisted Living","Innovative and Creative Developments in Multimodal Interaction Systems","","","","10.1007/978-3-642-55143-7_9","João RosasLuis M. Camarinha-MatosGonçalo CarvalhoAna Inês OliveiraFilipa Ferrada","2014","http://link.springer.com/chapter/10.1007/978-3-642-55143-7_9","Chapter"
"A study of graphics hardware accelerated particle swarm optimization with digital pheromones","Structural and Multidisciplinary Optimization","","51","6","10.1007/s00158-014-1215-7","Vijay KalivarapuEliot Winer","2015","http://link.springer.com/article/10.1007/s00158-014-1215-7","Article"
"On the Design of a Robotic System Composed of an Unmanned Surface Vehicle and a Piggybacked VTOL","Technological Innovation for Collective Awareness Systems","","","","10.1007/978-3-642-54734-8_22","Eduardo PintoPedro SantanaFrancisco MarquesRicardo MendonçaAndré LourençoJosé Barata","2014","http://link.springer.com/chapter/10.1007/978-3-642-54734-8_22","Chapter"
"Virtual Integration in the Development Process of ADAS","Handbook of Driver Assistance Systems","","","","10.1007/978-3-319-12352-3_8","Stephan HakuliMarkus Krug","2016","http://link.springer.com/referenceworkentry/10.1007/978-3-319-12352-3_8","ReferenceWorkEntry"
"FUmanoids Code Release 2012","RoboCup 2013: Robot World Cup XVII","","","","10.1007/978-3-662-44468-9_55","Daniel SeifertRaúl Rojas","2014","http://link.springer.com/chapter/10.1007/978-3-662-44468-9_55","Chapter"
"Context Aware and Adaptive Systems","Context in Computing","","","","10.1007/978-1-4939-1887-4_5","Alan ColmanMahmoud HusseinJun HanMalinda Kapuruge","2014","http://link.springer.com/chapter/10.1007/978-1-4939-1887-4_5","Chapter"
"Surface Applications for Security Analysis","Collaboration Meets Interactive Spaces","","","","10.1007/978-3-319-45853-3_17","Judith M. BrownJeff WilsonPeter SimonyiMiran MirzaRobert Biddle","2016","http://link.springer.com/chapter/10.1007/978-3-319-45853-3_17","Chapter"
"Development of Science Gateways Using QCG — Lessons Learned from the Deployment on Large Scale Distributed and HPC Infrastructures","Journal of Grid Computing","","14","4","10.1007/s10723-016-9384-9","T. PiontekB. BosakM. CiżnickiP. GrabowskiP. KoptaM. KulczewskiD. SzejnfeldK. Kurowski","2016","http://link.springer.com/article/10.1007/s10723-016-9384-9","Article"
"Semantic Matching of Components at Run-Time in Distributed Environments","On the Move to Meaningful Internet Systems: OTM 2015 Workshops","","","","10.1007/978-3-319-26138-6_46","Javier CriadoLuis IribarneNicolás PadillaRosa Ayala","2015","http://link.springer.com/chapter/10.1007/978-3-319-26138-6_46","Chapter"
"KINterestTV - Towards Non–invasive Measure of User Interest While Watching TV","Innovative and Creative Developments in Multimodal Interaction Systems","","","","10.1007/978-3-642-55143-7_8","Julien LeroyFrançois RoccaMatei MancasRadhwan Ben MadhkourFabien GrisardTomas KliegrJaroslav KucharJakub VitIvan PirnerPetr Zimmermann","2014","http://link.springer.com/chapter/10.1007/978-3-642-55143-7_8","Chapter"
"Middleware Support for Self-aware Computing Systems","Self-aware Computing Systems","","","","10.1007/978-3-319-39675-0_11","Jennifer SimonjanBernhard DieberBernhard Rinner","2016","http://link.springer.com/chapter/10.1007/978-3-319-39675-0_11","Chapter"
"Patient Centric Ontology for Telehealth Domain","Inclusive Smart Cities and e-Health","","","","10.1007/978-3-319-19312-0_20","Daniel Bjerring JørgensenKasper HallenborgYves Demazeau","2015","http://link.springer.com/chapter/10.1007/978-3-319-19312-0_20","Chapter"
"ROS-I Interface for COMAU Robots","Simulation, Modeling, and Programming for Autonomous Robots","","","","10.1007/978-3-319-11900-7_21","Stefano MichielettoElisa ToselloFabrizio RomanelliValentina FerraraEmanuele Menegatti","2014","http://link.springer.com/chapter/10.1007/978-3-319-11900-7_21","Chapter"
"Development of a Virtual Simulator for Microanastomosis: New Opportunities and Challenges","Augmented Reality, Virtual Reality, and Computer Graphics","","","","10.1007/978-3-319-40651-0_6","Valerio De LucaAntonio MeoAntonio MongelliPietro VecchioLucio T. De Paolis","2016","http://link.springer.com/chapter/10.1007/978-3-319-40651-0_6","Chapter"
"One IoT: an IoT protocol and framework for OEMs to make IoT-enabled devices forward compatible","Journal of Reliable Intelligent Environments","","2","3","10.1007/s40860-016-0027-5","Gourinath BandaChaitanya Krishna BommakantiHarsh Mohan","2016","http://link.springer.com/article/10.1007/s40860-016-0027-5","Article"
"An Embodied AI Approach to Individual Differences: Supporting Self-Efficacy in Diabetic Children with an Autonomous Robot","Social Robotics","","","","10.1007/978-3-319-25554-5_40","Matthew LewisElettra OleariClara PozziLola Cañamero","2015","http://link.springer.com/chapter/10.1007/978-3-319-25554-5_40","Chapter"
"GeosensorBase: Integrating and Managing Huge Number of Heterogeneous Sensors Using Sensor Adaptors and Extended SQL Querying","Web and Wireless Geographical Information Systems","","","","10.1007/978-3-642-55334-9_7","Min Soo KimChung Ho LeeIn Sung JangKi-Joune Li","2014","http://link.springer.com/chapter/10.1007/978-3-642-55334-9_7","Chapter"
"KeJia Robot–An Attractive Shopping Mall Guider","Social Robotics","","","","10.1007/978-3-319-25554-5_15","Yingfeng ChenFeng WuWei ShuaiNingyang WangRongya ChenXiaoping Chen","2015","http://link.springer.com/chapter/10.1007/978-3-319-25554-5_15","Chapter"
"SenseCare: Towards an Experimental Platform for Home-Based, Visualisation of Emotional States of People with Dementia","Advanced Visual Interfaces. Supporting Big Data Applications","","","","10.1007/978-3-319-50070-6_5","Felix EngelRaymond BondAlfie KearyMaurice MulvennaPaul WalshHuiru ZhengHaiying WangUlrich KowohlMatthias Hemmje","2016","http://link.springer.com/chapter/10.1007/978-3-319-50070-6_5","Chapter"
"Design of a Kiosk Type Healthcare Robot System for Older People in Private and Public Places","Simulation, Modeling, and Programming for Autonomous Robots","","","","10.1007/978-3-319-11900-7_49","Ho Seok AhnI-Han KuoChandan DattaRebecca StaffordNgaire KerseKathy PeriElizabeth BroadbentBruce A. MacDonald","2014","http://link.springer.com/chapter/10.1007/978-3-319-11900-7_49","Chapter"
"Cat King’s Metamorphosis","Games for Training, Education, Health and Sports","","","","10.1007/978-3-319-05972-3_3","Heinrich SöbkeEva ChanRaban von ButtlarJessica Große-WortmannJörg Londong","2014","http://link.springer.com/chapter/10.1007/978-3-319-05972-3_3","Chapter"
"High-Level Internet of Things Applications Development Using Wireless Sensor Networks","Internet of Things","","","","10.1007/978-3-319-04223-7_4","Zhenyu SongMihai T. LazarescuRiccardo TomasiLuciano LavagnoMaurizio A. Spirito","2014","http://link.springer.com/chapter/10.1007/978-3-319-04223-7_4","Chapter"
"All Bent Out…","Robotic Fabrication in Architecture, Art and Design 2014","","","","10.1007/978-3-319-04663-1_21","Thibault SchwartzJoshua BardMadeline GanonZack Jacobson-WeaverMichael JeffersRichard Tursky","2014","http://link.springer.com/chapter/10.1007/978-3-319-04663-1_21","Chapter"
"Simulating Human-Robot Interactions for Dialogue Strategy Learning","Simulation, Modeling, and Programming for Autonomous Robots","","","","10.1007/978-3-319-11900-7_6","Grégoire MilliezEmmanuel FerreiraMichelangelo FioreRachid AlamiFabrice Lefèvre","2014","http://link.springer.com/chapter/10.1007/978-3-319-11900-7_6","Chapter"
"RAN-Map: a system for automatically producing API layers from RDF schemas","Journal of Ambient Intelligence and Humanized Computing","","8","2","10.1007/s12652-016-0394-z","Daniele TotiMarco Rinelli","2017","http://link.springer.com/article/10.1007/s12652-016-0394-z","Article"
"A Proactive Stateful Firewall for Software Defined Networking","Risks and Security of Internet and Systems","","","","10.1007/978-3-319-54876-0_10","Salaheddine ZerkaneDavid EspesPhilippe Le ParcFrederic Cuppens","2017","http://link.springer.com/chapter/10.1007/978-3-319-54876-0_10","Chapter"
"A Long and Winding Road Towards Modular Synthesis","Leveraging Applications of Formal Methods, Verification and Validation: Foundational Techniques","","","","10.1007/978-3-319-47166-2_21","George T. HeinemanJan BessaiBoris DüdderJakob Rehof","2016","http://link.springer.com/chapter/10.1007/978-3-319-47166-2_21","Chapter"
"Case Study: Virtual World Engine Staging a Pervasive Game","A Survey of Characteristic Engine Features for Technology-Sustained Pervasive Games","","","","10.1007/978-3-319-17632-1_3","Kim J. L. Nevelsteen","2015","http://link.springer.com/chapter/10.1007/978-3-319-17632-1_3","Chapter"
"A rule triggering system for automatic text-to-sign translation","Universal Access in the Information Society","","15","4","10.1007/s10209-015-0413-4","Michael FilholMohamed N. HadjadjBenoît Testu","2016","http://link.springer.com/article/10.1007/s10209-015-0413-4","Article"
"A Dynamic Data Warehousing Platform for Creating and Accessing Biomedical Data Lakes","Data Management and Analytics for Medicine and Healthcare","","","","10.1007/978-3-319-57741-8_7","Pradeeban KathiraveluAshish Sharma","2017","http://link.springer.com/chapter/10.1007/978-3-319-57741-8_7","Chapter"
"IoT Protocol Stack: A Layered View","Internet of Things  From Hype to Reality","","","","10.1007/978-3-319-44860-2_5","Ammar RayesSamer Salam","2017","http://link.springer.com/chapter/10.1007/978-3-319-44860-2_5","Chapter"
"SAT based enforcement of domotic effects in smart environments","Journal of Ambient Intelligence and Humanized Computing","","5","4","10.1007/s12652-013-0183-x","Fulvio CornoFaisal Razzak","2014","http://link.springer.com/article/10.1007/s12652-013-0183-x","Article"
"Neurotechnology-Centered Convergence","Handbook of Science and Technology Convergence","","","","10.1007/978-3-319-07052-0_21","Zack Lynch","2016","http://link.springer.com/referenceworkentry/10.1007/978-3-319-07052-0_21","ReferenceWorkEntry"
"CompatibleOne: The Open Source Cloud Broker","Journal of Grid Computing","","12","1","10.1007/s10723-013-9285-0","Sami YanguiIain-James MarshallJean-Pierre LaisneSamir Tata","2014","http://link.springer.com/article/10.1007/s10723-013-9285-0","Article"
"Information and Expertise Sharing in Inter-Organizational Crisis Management","Computer Supported Cooperative Work (CSCW)","","23","4 - 6","10.1007/s10606-014-9205-2","Benedikt LeyThomas LudwigVolkmar PipekDave RandallChristian ReuterTorben Wiedenhoefer","2014","http://link.springer.com/article/10.1007/s10606-014-9205-2","Article"
"A Cloud-Assisted Wearable System for Physical Rehabilitation","ICTs for Improving Patients Rehabilitation Research Techniques","","","","10.1007/978-3-662-48645-0_15","Giancarlo FortinoRaffaele Gravina","2015","http://link.springer.com/chapter/10.1007/978-3-662-48645-0_15","Chapter"
"An analysis of distance estimation to detect proximity in social interactions","Journal of Ambient Intelligence and Humanized Computing","","5","3","10.1007/s12652-012-0171-6","Venet OsmaniIacopo CarrerasAleksandar MaticPiret Saar","2014","http://link.springer.com/article/10.1007/s12652-012-0171-6","Article"
"A Resource Oriented Framework for Service Choreography over Wireless Sensor and Actor Networks","International Journal of Wireless Information Networks","","23","3","10.1007/s10776-016-0316-1","Clément DuhartPierre SauvageCyrille Bertelle","2016","http://link.springer.com/article/10.1007/s10776-016-0316-1","Article"
"Timeliner: Supporting Collaborative Scientific Writing","New Horizons in Web Based Learning","","","","10.1007/978-3-662-43454-3_2","Vladimir TombergDavid LamasMart LaanpereMartin Sillaots","2014","http://link.springer.com/chapter/10.1007/978-3-662-43454-3_2","Chapter"
"A Framework for Model-Driven Execution of Collaboration Structures","Advanced Information Systems Engineering","","","","10.1007/978-3-319-39696-5_2","Christoph Mayr-DornSchahram Dustdar","2016","http://link.springer.com/chapter/10.1007/978-3-319-39696-5_2","Chapter"
"Toward an intuitive sign language animation authoring system for the deaf","Universal Access in the Information Society","","15","4","10.1007/s10209-015-0409-0","Alexis HeloirFabrizio Nunnari","2016","http://link.springer.com/article/10.1007/s10209-015-0409-0","Article"
"The Essential Components of a Successful Galaxy Service","Journal of Grid Computing","","14","4","10.1007/s10723-016-9379-6","Annette McGrathSteve McMahonSean LiJoel LudbeyTim Ho","2016","http://link.springer.com/article/10.1007/s10723-016-9379-6","Article"
"Technical Challenges Towards an AAL Large Scale Deployment","Inclusive Smart Cities and e-Health","","","","10.1007/978-3-319-19312-0_1","Joaquim BellmuntThibaut TiberghienMounir MokhtariHamdi AloulouRomain Endelin","2015","http://link.springer.com/chapter/10.1007/978-3-319-19312-0_1","Chapter"
"On Some Information Geometric Approaches to Cyber Security","Operations Research, Engineering, and Cyber Security","","","","10.1007/978-3-319-51500-7_9","C. T. J. Dodson","2017","http://link.springer.com/chapter/10.1007/978-3-319-51500-7_9","Chapter"
"How to Control a Mobile Game","Computers Helping People with Special Needs","","","","10.1007/978-3-319-41264-1_71","Krzysztof DoboszJakub Ptak","2016","http://link.springer.com/chapter/10.1007/978-3-319-41264-1_71","Chapter"
"SOA Applied: Engineering Software as Processing Unit of a Serious Game","Games and Learning Alliance","","","","10.1007/978-3-319-50182-6_16","Daniel SchwarzHeinrich SöbkeAndreas F. HofmannGerald AngermairLars SchnatmannJörg Londong","2016","http://link.springer.com/chapter/10.1007/978-3-319-50182-6_16","Chapter"
"An Adaptable Infrastructure to Generate Training Datasets for Decompilation Issues","New Perspectives in Information Systems and Technologies, Volume 2","","","","10.1007/978-3-319-05948-8_9","Javier EscaladaFranciso Ortin","2014","http://link.springer.com/chapter/10.1007/978-3-319-05948-8_9","Chapter"
"A common approach to intelligent energy and mobility services in a smart city environment","Journal of Ambient Intelligence and Humanized Computing","","6","3","10.1007/s12652-015-0263-1","Marco LützenbergerNils MasuchTobias KüsterDaniel FreundMarcus VoßChristopher-Eyk HrabiaDenis PozoJohannes FähndrichFrank TrollmannJan KeiserSahin Albayrak","2015","http://link.springer.com/article/10.1007/s12652-015-0263-1","Article"
"Elementary? Question answering, IBM’s Watson, and the Jeopardy! challenge","Resonance","","19","3","10.1007/s12045-014-0029-7","Raman Chandrasekar","2014","http://link.springer.com/article/10.1007/s12045-014-0029-7","Article"
"Multi-objective code-smells detection using good and bad design examples","Software Quality Journal","","","","10.1007/s11219-016-9309-7","Usman MansoorMarouane KessentiniBruce R. MaximKalyanmoy Deb","2016","http://link.springer.com/article/10.1007/s11219-016-9309-7","Article"
"Considerations about quality in model-driven engineering","Software Quality Journal","","","","10.1007/s11219-016-9350-6","Fáber D. GiraldoSergio EspañaÓscar PastorWilliam J. Giraldo","2016","http://link.springer.com/article/10.1007/s11219-016-9350-6","Article"
"A Review of Extant M&S Literature Through Journal Profiling and Co-citation Analysis","Concepts and Methodologies for Modeling and Simulation","","","","10.1007/978-3-319-15096-3_15","Navonil MustafeeKorina KatsaliakiPaul Fishwick","2015","http://link.springer.com/chapter/10.1007/978-3-319-15096-3_15","Chapter"
"Panic Room: Experiencing Overload and Having Fun in the Process","Distributed, Ambient, and Pervasive Interactions","","","","10.1007/978-3-319-07788-8_23","Björn BankowskiThiemo ClausenDirk EhmenMaximilian ErnestusHenning HasemannTobias JuraAlexander KröllerDominik KrupkeMarco Nikander","2014","http://link.springer.com/chapter/10.1007/978-3-319-07788-8_23","Chapter"
"Measuring the Student’s Success Rate Using a Constraint Based Multi-modal Virtual Assembly Environment","Augmented and Virtual Reality","","","","10.1007/978-3-319-13969-2_4","Inam Ur RehmanSehat UllahIhsan Rabbi","2014","http://link.springer.com/chapter/10.1007/978-3-319-13969-2_4","Chapter"
"Criticality assessment of terrorism related events at different time scales","Journal of Ambient Intelligence and Humanized Computing","","8","1","10.1007/s12652-016-0416-x","Raul SormaniFrancesco ArchettiIlaria Giordani","2017","http://link.springer.com/article/10.1007/s12652-016-0416-x","Article"
"A model for learning objects adaptation in light of mobile and context-aware computing","Personal and Ubiquitous Computing","","20","2","10.1007/s00779-016-0902-3","Márcia AbechCristiano André da CostaJorge Luis Victória BarbosaSandro José RigoRodrigo da Rosa Righi","2016","http://link.springer.com/article/10.1007/s00779-016-0902-3","Article"
"A Cost-Efficient Tele-rehabilitation Device for Training Distal Upper Limb Functions After Stroke","ICTs for Improving Patients Rehabilitation Research Techniques","","","","10.1007/978-3-662-48645-0_8","Patrick WeissAlexander GabrechtMarcus HeldmannAchim SchweikardErik Maehle","2015","http://link.springer.com/chapter/10.1007/978-3-662-48645-0_8","Chapter"
