Authors,Title,Year,Source title,Volume,Issue,Art. No.,Page start,Page end,Page count,Cited by,DOI,Link,Document Type,Source,EID
"Varcholik, P., Laviola Jr., J.J., Nicholson, D.","TACTUS: A hardware and software testbed for research in multi-touch interaction",2009,"Lecture Notes in Computer Science (including subseries Lecture Notes in Artificial Intelligence and Lecture Notes in Bioinformatics)","5611 LNCS","PART 2",,"523","532",,,10.1007/978-3-642-02577-8_57,"https://www.scopus.com/inward/record.uri?eid=2-s2.0-70350327789&doi=10.1007%2f978-3-642-02577-8_57&partnerID=40&md5=69e1874ed072bb436f71adea9496d408",Conference Paper,Scopus,2-s2.0-70350327789
"Rehrl, T., Bannat, A., Gast, J., Rigoll, G., Wallhoff, F.","CfHMI: A novel contact-free human-machine interface",2009,"Lecture Notes in Computer Science (including subseries Lecture Notes in Artificial Intelligence and Lecture Notes in Bioinformatics)","5611 LNCS","PART 2",,"246","254",,1,10.1007/978-3-642-02577-8_27,"https://www.scopus.com/inward/record.uri?eid=2-s2.0-70350327810&doi=10.1007%2f978-3-642-02577-8_27&partnerID=40&md5=3c68cdf4a05f27bbc501ef1ccf5671e8",Conference Paper,Scopus,2-s2.0-70350327810
"Chen, C.-H., Nian, C.-X.","VTouch: A vision-base dual finger touched inputs for large displays",2009,"Lecture Notes in Computer Science (including subseries Lecture Notes in Artificial Intelligence and Lecture Notes in Bioinformatics)","5611 LNCS","PART 2",,"426","434",,,10.1007/978-3-642-02577-8_46,"https://www.scopus.com/inward/record.uri?eid=2-s2.0-70350266836&doi=10.1007%2f978-3-642-02577-8_46&partnerID=40&md5=77bd9d0cdc69e33a2e45456b2a2a9141",Conference Paper,Scopus,2-s2.0-70350266836
"Inverardi, P., Pelliccione, P., Tivoli, M.","Towards an assume-guarantee theory for adaptable systems",2009,"Proceedings of the 2009 ICSE Workshop on Software Engineering for Adaptive and Self-Managing Systems, SEAMS 2009",,, 5069079,"106","115",,16,10.1109/SEAMS.2009.5069079,"https://www.scopus.com/inward/record.uri?eid=2-s2.0-70349923604&doi=10.1109%2fSEAMS.2009.5069079&partnerID=40&md5=bed0256a7cf67a1a8be63e70c357e4c4",Conference Paper,Scopus,2-s2.0-70349923604
"Feldmann, M., Janeiro, J., Nestler, T., Hübsch, G., Jugel, U., Preussner, A., Schill, A.","An integrated approach for creating service-based interactive applications",2009,"Lecture Notes in Computer Science (including subseries Lecture Notes in Artificial Intelligence and Lecture Notes in Bioinformatics)","5727 LNCS","PART 2",,"896","899",,6,10.1007/978-3-642-03658-3_105,"https://www.scopus.com/inward/record.uri?eid=2-s2.0-70349574226&doi=10.1007%2f978-3-642-03658-3_105&partnerID=40&md5=b6cfe4b09323c1c66fc0775a8fb521eb",Conference Paper,Scopus,2-s2.0-70349574226
"Djenidi, H., Ramdane-Cherif, A., Lévy, N.","Adaptative multimodal architectures managing software qualities",2009,"ICAART 2009 - Proceedings of the 1st International Conference on Agents and Artificial Intelligence",,,,"349","352",,1,,"https://www.scopus.com/inward/record.uri?eid=2-s2.0-70349446749&partnerID=40&md5=2cfb0bb5a5332e3cc66aa6073dfce5cb",Conference Paper,Scopus,2-s2.0-70349446749
"Chen, D.-Y., Xiahou, S.-J., Huang, Z.-Q., Li, X.-Y., Song, H.-T.","Wearable computing technology for industry applications",2009,"Dianzi Keji Daxue Xuebao/Journal of the University of Electronic Science and Technology of China","38","5",,"678","686",,3,10.3969/j.issn.1001-0548.2009.05.027,"https://www.scopus.com/inward/record.uri?eid=2-s2.0-70350548392&doi=10.3969%2fj.issn.1001-0548.2009.05.027&partnerID=40&md5=7454123d28920f7b64d7456fa01bff04",Article,Scopus,2-s2.0-70350548392
"Jayadevappa, S., Shankar, R.","The changing ways of computer science &amp; engineering education: A suitable pedagogy to adapt better",2009,"ASEE Annual Conference and Exposition, Conference Proceedings",,,,"","",10,,,"https://www.scopus.com/inward/record.uri?eid=2-s2.0-69249170989&partnerID=40&md5=7f8cb83b62f80f0aba9e8ddbbcbb1ebb",Conference Paper,Scopus,2-s2.0-69249170989
"Wang, F., Zhao, Z., Jiang, C.","Design of upper computer's integrated software for ionospheric monostatic system",2009,"Huazhong Keji Daxue Xuebao (Ziran Kexue Ban)/Journal of Huazhong University of Science and Technology (Natural Science Edition)","37","5",,"22","25",,,,"https://www.scopus.com/inward/record.uri?eid=2-s2.0-67649188446&partnerID=40&md5=31658fc8d89f141a050af59d8d2fcb9e",Article,Scopus,2-s2.0-67649188446
"Dimakis, N., Gkekas, G., Karame, G., Karachristos, T., Tsolakidis, S., Soldatos, J.K., Polymenakos, L.","Facilitating human-centric service delivery using a pluggable service development framework",2009,"International Journal of Ad Hoc and Ubiquitous Computing","4","3-4",,"223","236",,1,10.1504/IJAHUC.2009.024525,"https://www.scopus.com/inward/record.uri?eid=2-s2.0-65349095640&doi=10.1504%2fIJAHUC.2009.024525&partnerID=40&md5=1f7dcdd1772e440e32304fec71475ee1",Article,Scopus,2-s2.0-65349095640
"Prada, R., Payandeh, S.","On study of design and implementation of virtual fixtures",2009,"Virtual Reality","13","2",,"117","129",,23,10.1007/s10055-009-0115-4,"https://www.scopus.com/inward/record.uri?eid=2-s2.0-67349210685&doi=10.1007%2fs10055-009-0115-4&partnerID=40&md5=4f17f7141b3d84c682254bb1e3d5a108",Article,Scopus,2-s2.0-67349210685
"Scoltock, J.","Screen test",2009,"Automotive Engineer (London)","34","2",,"37","41",,,,"https://www.scopus.com/inward/record.uri?eid=2-s2.0-62249176313&partnerID=40&md5=5dd924f32b0eb179c8676d21dca61c60",Article,Scopus,2-s2.0-62249176313
"Shneiderman, B.","Creativity support tools: A grand challenge for HCI researchers",2009,"Engineering the User Interface: From Research to Practice",,,,"1","9",,1,10.1007/978-1-84800-136-7-1,"https://www.scopus.com/inward/record.uri?eid=2-s2.0-84904092749&doi=10.1007%2f978-1-84800-136-7-1&partnerID=40&md5=2cc923d8bdadd6dc6398b0ee3f084bac",Conference Paper,Scopus,2-s2.0-84904092749
"Boxer, C.J.","A model-driven approach to graphical user interface development",2009,"16th ITS World Congress",,,,"","",,,,"https://www.scopus.com/inward/record.uri?eid=2-s2.0-84954497469&partnerID=40&md5=4190e0c117991bd6f1857d7c26738c64",Conference Paper,Scopus,2-s2.0-84954497469
"Echtler, F., Klinker, G.","A multitouch software architecture",2008,"ACM International Conference Proceeding Series","358",,,"463","466",,35,10.1145/1463160.1463220,"https://www.scopus.com/inward/record.uri?eid=2-s2.0-70049117992&doi=10.1145%2f1463160.1463220&partnerID=40&md5=c4ae875f3d10fd7450b5d74626248c0f",Conference Paper,Scopus,2-s2.0-70049117992
"Stoll, P., Alfredsson, F., Lövemark, S.","Usability supporting architecture pattern for industry",2008,"ACM International Conference Proceeding Series","358",,,"593","594",,,10.1145/1463160.1463259,"https://www.scopus.com/inward/record.uri?eid=2-s2.0-70049104957&doi=10.1145%2f1463160.1463259&partnerID=40&md5=39b1fe6415668d4147df96e46a3306fd",Conference Paper,Scopus,2-s2.0-70049104957
"Chang, S.H.-H., Chen, X., Priest, R.A., Plimmer, B.","Issues of extending the user interface of integrated development environments",2008,"ACM International Conference Proceeding Series",,,,"23","30",,1,10.1145/1496976.1496980,"https://www.scopus.com/inward/record.uri?eid=2-s2.0-70350675334&doi=10.1145%2f1496976.1496980&partnerID=40&md5=b3f9dc2eb21bf626e4c5aaf3d53084a8",Conference Paper,Scopus,2-s2.0-70350675334
"Bode, S., Riebisch, M.","Usability-Focused architectural design for graphical user interface components",2008,"2008 International Conference on Computational Intelligence for Modelling Control and Automation, CIMCA 2008",,, 5172804,"1246","1251",,,10.1109/CIMCA.2008.120,"https://www.scopus.com/inward/record.uri?eid=2-s2.0-70449555125&doi=10.1109%2fCIMCA.2008.120&partnerID=40&md5=968e0df9c2e76d9020bc25f90ad0c690",Conference Paper,Scopus,2-s2.0-70449555125
"Batkiewicz, T., Seth, A., Walter, B., Knutzon, J., Oliver, J.H.","A general architecture for distributed VR interfaces",2008,"Proceedings of the ASME Design Engineering Technical Conference","3","PARTS A AND B",,"1571","1578",,,10.1115/DETC2008-49845,"https://www.scopus.com/inward/record.uri?eid=2-s2.0-81155154380&doi=10.1115%2fDETC2008-49845&partnerID=40&md5=41a4daf4ae7d9e0d88fa944b3a3aeb4e",Conference Paper,Scopus,2-s2.0-81155154380
"Tavira-Mondragón, J., Jiménez-Fraustro, L., Romero-Jiménez, G.","A simulator for training fossil-fuel power plants operators with an HMI based on a multi-window system",2008,"Proceedings of the 2008 International Conference on Modeling, Simulation and Visualization Methods, MSV 2008",,,,"64","69",,,,"https://www.scopus.com/inward/record.uri?eid=2-s2.0-62749097396&partnerID=40&md5=61295ab26ba3a713c31f7e085fa2109b",Conference Paper,Scopus,2-s2.0-62749097396
"Stoll, P., John, B.E., Bass, L., Golden, E.","Preparing usability supporting architectural patterns for industrial use",2008,"CEUR Workshop Proceedings","407",,,"","",6,,,"https://www.scopus.com/inward/record.uri?eid=2-s2.0-84872199146&partnerID=40&md5=2cd8f4be1d3b206d47fc0b46eccc29db",Conference Paper,Scopus,2-s2.0-84872199146
"Kiss, Á., Martinek, P., Czilik, I.","Integrating HR offices over semantically enriched SOA",2008,"2008 31st International Spring Seminar on Electronics Technology: Reliability and Life-time Prediction, ISSE 2008",,, 5276644,"437","442",,,10.1109/ISSE.2008.5276644,"https://www.scopus.com/inward/record.uri?eid=2-s2.0-71249091323&doi=10.1109%2fISSE.2008.5276644&partnerID=40&md5=d6d11e250a653a11481660fb47ed8234",Conference Paper,Scopus,2-s2.0-71249091323
"Tran, C.D., Ezzedine, H., Kolski, C.","Evaluation of agent-based interactive systems: Proposal of an electronic informer using Petri Nets",2008,"Journal of Universal Computer Science","14","19",,"3202","3216",,17,,"https://www.scopus.com/inward/record.uri?eid=2-s2.0-63649112076&partnerID=40&md5=a67b37c0730faad2d2e9c3c01926d7a3",Article,Scopus,2-s2.0-63649112076
"Schmidt-Rohr, S.R., Lösch, M., Xue, Z., Dillmann, R.","Hardware and software architecture for robust autonomous behavior of a domestic robot assistant",2008,"Intelligent Autonomous Systems 10, IAS 2008",,,,"74","83",,,10.3233/978-1-58603-887-8-74,"https://www.scopus.com/inward/record.uri?eid=2-s2.0-84871732799&doi=10.3233%2f978-1-58603-887-8-74&partnerID=40&md5=5bd271e9d2d83dc7bdc61f0f62ee43f3",Conference Paper,Scopus,2-s2.0-84871732799
"Rivera, J., Samper, W., Clinger, B.","Live training transformation (LT2) product line applied standards for reusable integrated and interoperable solutions",2008,"Proceedings - IEEE Military Communications Conference MILCOM",,, 4753136,"","",,,10.1109/MILCOM.2008.4753136,"https://www.scopus.com/inward/record.uri?eid=2-s2.0-78650759646&doi=10.1109%2fMILCOM.2008.4753136&partnerID=40&md5=4ce7ddc6c7f919935a3bdae9a3c24c3b",Conference Paper,Scopus,2-s2.0-78650759646
"Wolter, C., Schaad, A., Meinel, C.","A transformation approach for security enhanced business processes",2008,"Proceedings of the IASTED International Conference on Software Engineering, SE 2008",,,,"14","19",,,,"https://www.scopus.com/inward/record.uri?eid=2-s2.0-62849120746&partnerID=40&md5=2d3fdb512bf0dca07cc8261762d05e2d",Conference Paper,Scopus,2-s2.0-62849120746
"Seffah, A., Mohamed, T., Habieb-Mammar, H., Abran, A.","Reconciling usability and interactive system architecture using patterns",2008,"Journal of Systems and Software","81","11",,"1845","1852",,23,10.1016/j.jss.2008.04.037,"https://www.scopus.com/inward/record.uri?eid=2-s2.0-52049115406&doi=10.1016%2fj.jss.2008.04.037&partnerID=40&md5=1f27885751f2712cd5085d7b53944488",Article,Scopus,2-s2.0-52049115406
"Folmer, E., Bosch, J.","Experiences with software architecture analysis of usability",2008,"International Journal of Information Technology and Web Engineering","3","4",,"1","29",,3,,"https://www.scopus.com/inward/record.uri?eid=2-s2.0-73649114272&partnerID=40&md5=55281509f35362d579d54310fa1f7306",Article,Scopus,2-s2.0-73649114272
"Pastor, O., España, S., Panach, J.I., Aquino, N.","Model-driven development",2008,"Informatik-Spektrum","31","5",,"394","407",,25,10.1007/s00287-008-0275-8,"https://www.scopus.com/inward/record.uri?eid=2-s2.0-52949088643&doi=10.1007%2fs00287-008-0275-8&partnerID=40&md5=e8d1046fabdaf2d548be7b2b69bc4ff1",Article,Scopus,2-s2.0-52949088643
"Mori, G., Paternò, F., Spano, L.D.","Exploiting web services and model-based user interfaces for multi-device access to home applications",2008,"Lecture Notes in Computer Science (including subseries Lecture Notes in Artificial Intelligence and Lecture Notes in Bioinformatics)","5136 LNCS",,,"181","193",,2,10.1007/978-3-540-70569-7_18,"https://www.scopus.com/inward/record.uri?eid=2-s2.0-50549097525&doi=10.1007%2f978-3-540-70569-7_18&partnerID=40&md5=732b18ea97233f9e6226eff4d8dc870f",Conference Paper,Scopus,2-s2.0-50549097525
"Jeng, I.-H., Chang, A.Y., Wang, Y.-R.","Plug into the online database and play mobile web 2.0",2008,"IT Professional","10","5", 4629847,"34","38",,2,10.1109/MITP.2008.107,"https://www.scopus.com/inward/record.uri?eid=2-s2.0-52949106162&doi=10.1109%2fMITP.2008.107&partnerID=40&md5=f017a13d75126de9435f1326724fd9ca",Article,Scopus,2-s2.0-52949106162
"Link, S., Schuster, T., Hoyer, P., Abeck, S.","Focusing graphical user interfaces in model-driven software development",2008,"Proceedings of the 1st International Conference on Advances in Computer-Human Interaction, ACHI 2008",,, 4455950,"3","8",,22,10.1109/ACHI.2008.16,"https://www.scopus.com/inward/record.uri?eid=2-s2.0-47349111115&doi=10.1109%2fACHI.2008.16&partnerID=40&md5=1a90b0ebb9b514d27f5f4a9901d82d54",Conference Paper,Scopus,2-s2.0-47349111115
"Soro, A., Paddeu, G., Lobina, M.L.","Multitouch sensing for collaborative interactive walls",2008,"IFIP International Federation for Information Processing","272",,,"207","212",,2,10.1007/978-0-387-09678-0_20,"https://www.scopus.com/inward/record.uri?eid=2-s2.0-47249105656&doi=10.1007%2f978-0-387-09678-0_20&partnerID=40&md5=a5227b49b66f51a38b6ebbc0176d735a",Conference Paper,Scopus,2-s2.0-47249105656
"Cho, H., Yang, J.-S.","Architecture patterns for mobile games product lines",2008,"International Conference on Advanced Communication Technology, ICACT","1",, 4493725,"118","122",,9,10.1109/ICACT.2008.4493725,"https://www.scopus.com/inward/record.uri?eid=2-s2.0-44249103782&doi=10.1109%2fICACT.2008.4493725&partnerID=40&md5=7df857d0c7c002be84c5cb8faf20ef52",Conference Paper,Scopus,2-s2.0-44249103782
[No author name available],"TEI'08 - Second International Conference on Tangible and Embedded Interaction - Conference proceedings",2008,"TEI'08 - Second International Conference on Tangible and Embedded Interaction - Conference Proceedings",,,,"","",261,,,"https://www.scopus.com/inward/record.uri?eid=2-s2.0-42549165940&partnerID=40&md5=937e2c839262a25760f146bb0666bf44",Conference Review,Scopus,2-s2.0-42549165940
"El-Hassan, O., Fiadeiro, J.L., Heckel, R.","Managing socio-technical interactions in healthcare systems",2008,"Lecture Notes in Computer Science (including subseries Lecture Notes in Artificial Intelligence and Lecture Notes in Bioinformatics)","4928 LNCS",,,"347","358",,1,10.1007/978-3-540-78238-4_36,"https://www.scopus.com/inward/record.uri?eid=2-s2.0-40549139456&doi=10.1007%2f978-3-540-78238-4_36&partnerID=40&md5=aa8310f0300eba20902fe4b5bfe5621b",Conference Paper,Scopus,2-s2.0-40549139456
"Varano, S., Bignon, J.-C., Bur, D.","Playable maps / sensitive maps materializing the learner's mental map",2008,"4th International North-American Conference on Intelligent Games and Simulation, Game-On 'NA 2008",,,,"30","34",,,,"https://www.scopus.com/inward/record.uri?eid=2-s2.0-84898639419&partnerID=40&md5=140aae4a3efe4567e57dad6fb3f63d3c",Conference Paper,Scopus,2-s2.0-84898639419
"Dai, G., Bai, X., Wang, Y., Dai, F.","Contract-based testing for web services",2007,"Proceedings - International Computer Software and Applications Conference","1",, 4291045,"517","524",,36,10.1109/COMPSAC.2007.100,"https://www.scopus.com/inward/record.uri?eid=2-s2.0-37349123096&doi=10.1109%2fCOMPSAC.2007.100&partnerID=40&md5=c4a6921cabc94e7a7343736de8120666",Conference Paper,Scopus,2-s2.0-37349123096
[No author name available],"Proceedings - ICSE 2007 Workshops: Third International Workshop on Predictor Models in Software Engineering, PROMISE'07",2007,"Proceedings - ICSE 2007 Workshops: Third International Workshop on Predictor Models in Software Engineering, PROMISE'07",,,,"","",104,,,"https://www.scopus.com/inward/record.uri?eid=2-s2.0-36949039006&partnerID=40&md5=377d0cedcaf9acedc3d3ca9d18f05e5e",Conference Review,Scopus,2-s2.0-36949039006
"Jacquet, C., Bellik, Y., Bourda, Y.","Kup: A model for the multimodal presentation of information in ambient intelligence",2007,"IET Conference Publications",,"531 CP",,"432","439",,,10.1049/cp:20070403,"https://www.scopus.com/inward/record.uri?eid=2-s2.0-67649814756&doi=10.1049%2fcp%3a20070403&partnerID=40&md5=edeaeadf6cc8a7bd1f0c9039092f0dd6",Conference Paper,Scopus,2-s2.0-67649814756
"Paternò, F., Santos, I.","Designing and developing multi-user, multi-device web interfaces",2007,"Computer-Aided Design of User Interfaces V - Proceedings of the 6th International Conference on Computer-Aided Design of User Interfaces, CADUI 2006",,,,"111","122",,3,,"https://www.scopus.com/inward/record.uri?eid=2-s2.0-84879637460&partnerID=40&md5=5edb96517176d7e177d93761ab0a99c4",Conference Paper,Scopus,2-s2.0-84879637460
"Paredes, H., Martins, F.M.","Social theatres: A web-based regulated social interaction environment",2007,"Lecture Notes in Computer Science (including subseries Lecture Notes in Artificial Intelligence and Lecture Notes in Bioinformatics)","4715 LNCS",,,"87","94",,3,,"https://www.scopus.com/inward/record.uri?eid=2-s2.0-38149115462&partnerID=40&md5=ab0e0a943967f30c1b8347ea1b805f13",Conference Paper,Scopus,2-s2.0-38149115462
"Canou, J., Sallé, D., Traonmillin, M., Dupourqué, V.","The anglet experiment: A Cybercar on the beach",2007,"Lecture Notes in Computer Science (including subseries Lecture Notes in Artificial Intelligence and Lecture Notes in Bioinformatics)","4739 LNCS",,,"1066","1072",,,,"https://www.scopus.com/inward/record.uri?eid=2-s2.0-38449109470&partnerID=40&md5=a3d88d9170874b8529670c68d75f4834",Conference Paper,Scopus,2-s2.0-38449109470
"Müller, D.N., De Siqueira, M.L., Navaux, P.O.A.","The use of artificial neural networks in the speech understanding model - SUM",2007,"Lecture Notes in Computer Science (including subseries Lecture Notes in Artificial Intelligence and Lecture Notes in Bioinformatics)","4669 LNCS","PART 2",,"496","505",,,,"https://www.scopus.com/inward/record.uri?eid=2-s2.0-38149072522&partnerID=40&md5=4cd0800024374027d79dc1a08777b298",Conference Paper,Scopus,2-s2.0-38149072522
"Snyder, M.","Small form factor safety critical operator control unit for unmanned vehicles",2007,"Association for Unmanned Vehicle Systems International - Unmanned Systems North America Conference 2007","2",,,"948","956",,,,"https://www.scopus.com/inward/record.uri?eid=2-s2.0-70449102609&partnerID=40&md5=1836426e4b7490a06a8433c63e00a86d",Conference Paper,Scopus,2-s2.0-70449102609
"Xie, Y., Zhang, Y., Yang, Z.","A middleware framework based on the IEEE 1451 standards",2007,"2007 International Conference on Wireless Communications, Networking and Mobile Computing, WiCOM 2007",,, 4340549,"3119","3122",,3,10.1109/WICOM.2007.774,"https://www.scopus.com/inward/record.uri?eid=2-s2.0-38049063588&doi=10.1109%2fWICOM.2007.774&partnerID=40&md5=ae058da6305664a8198e296b79293f09",Conference Paper,Scopus,2-s2.0-38049063588
"Kim, T.-H., Youn, J.-S., Hong, K.-S.","Toward a novel multi-modal HCI: Fusion architecture using confidence score and fuzzy value",2007,"Lecture Notes in Computer Science (including subseries Lecture Notes in Artificial Intelligence and Lecture Notes in Bioinformatics)","4692 LNAI","PART 1",,"246","253",,1,,"https://www.scopus.com/inward/record.uri?eid=2-s2.0-38049151248&partnerID=40&md5=695a60d02987738aac8de52614a88bf7",Conference Paper,Scopus,2-s2.0-38049151248
"Cámara, J., Canal, C., Cubo, J., Murillo, J.M.","Enabling adaptivity in user interfaces",2007,"Lecture Notes in Computer Science (including subseries Lecture Notes in Artificial Intelligence and Lecture Notes in Bioinformatics)","4758 LNCS",,,"106","114",,2,,"https://www.scopus.com/inward/record.uri?eid=2-s2.0-38149040249&partnerID=40&md5=99a351bd59d6f23526ffaf09a19150b2",Conference Paper,Scopus,2-s2.0-38149040249
"Ramirez-Velarde, R.V., Garcia-Rueda, J.J., Alexandrov, N.","Creating interactive environments for education",2007,"CEUR Workshop Proceedings","280",,,"","",6,,,"https://www.scopus.com/inward/record.uri?eid=2-s2.0-84884617576&partnerID=40&md5=02d2d06f004ceedb8833565e1872fb82",Conference Paper,Scopus,2-s2.0-84884617576
"Kim, J.-H., Hong, K.-S.","Approach to extended CSCW design based on embedded Korean sign language recognizer",2007,"Lecture Notes in Computer Science (including subseries Lecture Notes in Artificial Intelligence and Lecture Notes in Bioinformatics)","4402 LNCS",,,"287","296",,,,"https://www.scopus.com/inward/record.uri?eid=2-s2.0-38149120468&partnerID=40&md5=56560c1743d9af0b1af08cf0ec8a6b67",Conference Paper,Scopus,2-s2.0-38149120468
"Hoch, St., Althoff, F., Rigoll, G.","The ConnectedDrive context server - Flexible software architecture for a context aware vehicle",2007,"Advanced Microsystems for Automotive Applications 2007",,,,"201","212",,6,10.1007/978-3-540-71325-8_16,"https://www.scopus.com/inward/record.uri?eid=2-s2.0-57749168736&doi=10.1007%2f978-3-540-71325-8_16&partnerID=40&md5=2b7b2f5ee55a3e8b63d8f0be27a229ab",Conference Paper,Scopus,2-s2.0-57749168736
"Gu, Q., Lago, P.","A stakeholder-driven service life cycle model for SOA",2007,"IW-SOSWE'07: 2nd International Workshop on Service Oriented Software Engineering - In conjunction with the 6th ESEC/FSE Joint Meeting",,,,"1","7",,27,10.1145/1294928.1294930,"https://www.scopus.com/inward/record.uri?eid=2-s2.0-41149136581&doi=10.1145%2f1294928.1294930&partnerID=40&md5=971352c85a3e1fc958f47ec1673dbc44",Conference Paper,Scopus,2-s2.0-41149136581
"Palmer, D., Adcock, M., Smith, J., Hutchins, M., Gunn, C., Stevenson, D., Taylor, K.","Annotating with light for remote guidance",2007,"Australasian Computer-Human Interaction Conference, OZCHI'07",,,,"103","110",,14,,"https://www.scopus.com/inward/record.uri?eid=2-s2.0-57349163082&partnerID=40&md5=3d8f009a57a6ee7874f2975dc65aaaa8",Conference Paper,Scopus,2-s2.0-57349163082
"Pastor, Ó.","Generating user interfaces from conceptual models: A modeltransformation based approach",2007,"Computer-Aided Design of User Interfaces V - Proceedings of the 6th International Conference on Computer-Aided Design of User Interfaces, CADUI 2006",,,,"1","14",,5,,"https://www.scopus.com/inward/record.uri?eid=2-s2.0-84879681495&partnerID=40&md5=ddef90d1021c316aa6dd57f3ed070167",Conference Paper,Scopus,2-s2.0-84879681495
"Sharma, H., Ramani, A.K.","Model driven performance analysis of Human Machine Interface Framework for In-vehicle Infotainment systems",2007,"Lecture Notes in Engineering and Computer Science",,,,"429","434",,,,"https://www.scopus.com/inward/record.uri?eid=2-s2.0-84888308713&partnerID=40&md5=5b756ccd7c3fa5eb86ba170762366a00",Conference Paper,Scopus,2-s2.0-84888308713
"Pederiva, I., Vanderdonckt, J., España, S., Panach, I., Pastor, O.","The beautification process in model-driven engineering of user interfaces",2007,"Lecture Notes in Computer Science (including subseries Lecture Notes in Artificial Intelligence and Lecture Notes in Bioinformatics)","4662 LNCS","PART 1",,"411","425",,10,,"https://www.scopus.com/inward/record.uri?eid=2-s2.0-38049147950&partnerID=40&md5=729141b43072307a6ae8308cdd2c7eda",Conference Paper,Scopus,2-s2.0-38049147950
"Doswell, J., Harmeyer, K.","Extending the 'serious game' boundary: Virtual instructors in mobile mixed reality learning games",2007,"3rd Digital Games Research Association International Conference: ""Situated Play"", DiGRA 2007",,,,"524","529",,18,,"https://www.scopus.com/inward/record.uri?eid=2-s2.0-79960335526&partnerID=40&md5=b4eaeb269191f8d2935618307331cf89",Conference Paper,Scopus,2-s2.0-79960335526
"Amann, K.-H., Bernhard, U.","Decoupled HMI software architecture",2007,"VDI Berichte",,"2000",,"411","420",,,,"https://www.scopus.com/inward/record.uri?eid=2-s2.0-36349009753&partnerID=40&md5=3709dcb6d159a7c9f89e05b2b009a47f",Article,Scopus,2-s2.0-36349009753
[No author name available],"Proceedings - ICSE 2007 Workshops: Fourth International Workshop on Software Engineering for Automotive Systems, SEAS'07",2007,"Proceedings - ICSE 2007 Workshops: Fourth International Workshop on Software Engineering for Automotive Systems, SEAS'07",,,,"","",63,,,"https://www.scopus.com/inward/record.uri?eid=2-s2.0-36249003293&partnerID=40&md5=502037c67446d0eef4472cff3981f951",Conference Review,Scopus,2-s2.0-36249003293
"Samples, B.A.","A scalable soldier-machine interface for human-robotic interaction",2007,"Proceedings of SPIE - The International Society for Optical Engineering","6561",, 65610Y,"","",,,10.1117/12.719771,"https://www.scopus.com/inward/record.uri?eid=2-s2.0-35948943180&doi=10.1117%2f12.719771&partnerID=40&md5=7c81aec42b727ff89c20de52fac17a7e",Conference Paper,Scopus,2-s2.0-35948943180
"Chen, H.-M., Chen, P.-H., Dorjgochoo, S., Pan, T.-J., Lai, F.","A hard-disk based portable entertainment device for managing contents on the go",2007,"WSEAS Transactions on Computers","6","11",,"1125","1133",,,,"https://www.scopus.com/inward/record.uri?eid=2-s2.0-38349108511&partnerID=40&md5=9debafd3761fb6144a36ed888141430a",Article,Scopus,2-s2.0-38349108511
"Schedlbauer, M.J.","An extensible platform for the interactive exploration of Fitts' Law and related movement time models",2007,"Conference on Human Factors in Computing Systems - Proceedings",,,,"2633","2638",,8,10.1145/1240866.1241054,"https://www.scopus.com/inward/record.uri?eid=2-s2.0-35348900772&doi=10.1145%2f1240866.1241054&partnerID=40&md5=7e8927cc2b0676b42471694ef8d14610",Conference Paper,Scopus,2-s2.0-35348900772
