Item Title,Publication Title,Book Series Title,Journal Volume,Journal Issue,Item DOI,Authors,Publication Year,URL,Content Type
"exIMUs: An Experimental Inertial Measurement Unit for Shock and Impact Detection in Sport Applications","Internet of Things. IoT Infrastructures","","","","10.1007/978-3-319-47075-7_28","Ivan MinakovRoberto Passerone","2016","http://link.springer.com/chapter/10.1007/978-3-319-47075-7_28","Chapter"
"On the use of models for high-performance scientific computing applications: an experience report","Software & Systems Modeling","","","","10.1007/s10270-016-0518-0","Ileana OberMarc PalyartJean-Michel BruelDavid Lugato","2016","http://link.springer.com/article/10.1007/s10270-016-0518-0","Article"
"Integrating Business Information Streams in a Core Banking Architecture: A Practical Experience","Enterprise Information Systems","","","","10.1007/978-3-319-22348-3_23","Beatriz San MiguelJose M. del AlamoJuan C. Yelmo","2015","http://link.springer.com/chapter/10.1007/978-3-319-22348-3_23","Chapter"
"Introduction to the Handbook on UAVs","Handbook of Unmanned Aerial Vehicles","","","","10.1007/978-90-481-9707-1_91","Kimon P. ValavanisGeorge J. Vachtsevanos","2015","http://link.springer.com/referenceworkentry/10.1007/978-90-481-9707-1_91","ReferenceWorkEntry"
"Engineering IoT Healthcare Applications: Towards a Semantic Data Driven Sustainable Architecture","eHealth 360°","","","","10.1007/978-3-319-49655-9_49","Rita ZgheibEmmanuel ConchonRémi Bastide","2017","http://link.springer.com/chapter/10.1007/978-3-319-49655-9_49","Chapter"
"Strategic Knowledge Management for Interdisciplinary Teams - Overcoming Barriers of Interdisciplinary Work Via an Online Portal Approach","Human Interface and the Management of Information: Applications and Services","","","","10.1007/978-3-319-40397-7_38","Tatjana HamannAnne Kathrin SchaarAndré Calero ValdezMartina Ziefle","2016","http://link.springer.com/chapter/10.1007/978-3-319-40397-7_38","Chapter"
"Multi-Robot Localization and Mapping Based on Signed Distance Functions","Journal of Intelligent & Robotic Systems","","83","3 - 4","10.1007/s10846-016-0375-7","Philipp KochStefan MayMichael SchmidpeterMarkus KühnChristian PfitznerChristian MerklRainer KochMartin FeesJon MartinDaniel AmmonAndreas Nüchter","2016","http://link.springer.com/article/10.1007/s10846-016-0375-7","Article"
"Architecture Challenges for Intelligent Autonomous Machines","Intelligent Autonomous Systems 13","","","","10.1007/978-3-319-08338-4_120","Sagar BehereFredrik AsplundAndreas SöderbergMartin Törngren","2016","http://link.springer.com/chapter/10.1007/978-3-319-08338-4_120","Chapter"
"Towards an Architecture for a Scalable and Collaborative AmI Environment","Trends in Practical Applications of Scalable Multi-Agent Systems, the PAAMS Collection","","","","10.1007/978-3-319-40159-1_26","Cristina RodaArturo RodríguezElena NavarroVíctor López-JaqueroPascual González","2016","http://link.springer.com/chapter/10.1007/978-3-319-40159-1_26","Chapter"
"Performance Driven WS Orchestration and Deployment in Service Oriented Infrastructure","Journal of Grid Computing","","12","2","10.1007/s10723-014-9293-8","Salvatore DistefanoGiuseppe Serazzi","2014","http://link.springer.com/article/10.1007/s10723-014-9293-8","Article"
"LabVIEW™ FPGA","Fuzzy Logic Type 1 and Type 2 Based on LabVIEW™ FPGA","","","","10.1007/978-3-319-26656-5_2","Pedro Ponce-CruzArturo MolinaBrian MacCleery","2016","http://link.springer.com/chapter/10.1007/978-3-319-26656-5_2","Chapter"
"Data collection in global software engineering research: learning from past experience","Empirical Software Engineering","","19","4","10.1007/s10664-012-9240-x","Rafael PrikladnickiAlexander BodenGabriela AvramCleidson R. B. de SouzaVolker Wulf","2014","http://link.springer.com/article/10.1007/s10664-012-9240-x","Article"
"Supporting Human-Robot Teams in Space Missions Using ePartners and Formal Abstraction Hierarchies","PRIMA 2015: Principles and Practice of Multi-Agent Systems","","","","10.1007/978-3-319-25524-8_24","Tibor BosseJurriaan van DiggelenMark A. NeerincxNanja J. J. M. Smets","2015","http://link.springer.com/chapter/10.1007/978-3-319-25524-8_24","Chapter"
"High Performance Relaying of C++11 Objects across Processes and Logic-Labeled Finite-State Machines","Simulation, Modeling, and Programming for Autonomous Robots","","","","10.1007/978-3-319-11900-7_16","Vlad Estivill-CastroRené HexelCarl Lusty","2014","http://link.springer.com/chapter/10.1007/978-3-319-11900-7_16","Chapter"
"Using Wearable and Contextual Computing to Optimize Field Engineering Work Practices","Human Interface and the Management of Information. Information and Knowledge in Context","","","","10.1007/978-3-319-20618-9_52","Roberto S. Silva FilhoChing-Ling HuangAnuj TewariJames JobinPiyush Modi","2015","http://link.springer.com/chapter/10.1007/978-3-319-20618-9_52","Chapter"
"The Proof of the WISE Concept","The Future Home is Wise, Not Smart","","","","10.1007/978-3-319-23093-1_7","Gerhard Leitner","2015","http://link.springer.com/chapter/10.1007/978-3-319-23093-1_7","Chapter"
"Blueprint for Software Engineering in Technology Enhanced Learning Projects","Open Learning and Teaching in Educational Communities","","","","10.1007/978-3-319-11200-8_33","Michael DerntlIstván KorenPetru NicolaescuDominik RenzelRalf Klamma","2014","http://link.springer.com/chapter/10.1007/978-3-319-11200-8_33","Chapter"
"Touching graphical applications: bimanual tactile interaction on the HyperBraille pin-matrix display","Universal Access in the Information Society","","","","10.1007/s10209-017-0538-8","Denise PrescherJens BornscheinWiebke KöhlmannGerhard Weber","2017","http://link.springer.com/article/10.1007/s10209-017-0538-8","Article"
"Getting the Query Right: User Interface Design of Analysis Platforms for Crisis Research","Engineering the Web in the Big Data Era","","","","10.1007/978-3-319-19890-3_35","Mario BarrenecheaKenneth M. AndersonAhmet Arif AydinMazin HakeemSahar Jambi","2015","http://link.springer.com/chapter/10.1007/978-3-319-19890-3_35","Chapter"
"Team Homer@UniKoblenz — Approaches and Contributions to the RoboCup@Home Competition","RoboCup 2015: Robot World Cup XIX","","","","10.1007/978-3-319-29339-4_7","Viktor SeibStephan MantheRaphael MemmesheimerFlorian PolsterDietrich Paulus","2015","http://link.springer.com/chapter/10.1007/978-3-319-29339-4_7","Chapter"
"SaaS Approach to the Process Control Teaching and Engineering","Cooperative Design, Visualization, and Engineering","","","","10.1007/978-3-319-10831-5_43","Grzegorz PolakówWitold Nocoń","2014","http://link.springer.com/chapter/10.1007/978-3-319-10831-5_43","Chapter"
"Realization of a Cognitive Supervisory System for Laser Microsurgery","Cognitive Supervision for Robot-Assisted Minimally Invasive Laser Surgery","","","","10.1007/978-3-319-30330-7_6","Loris Fichera","2016","http://link.springer.com/chapter/10.1007/978-3-319-30330-7_6","Chapter"
"Flexible Protocol Stacks","Self-aware Computing Systems","","","","10.1007/978-3-319-39675-0_10","Markus HappeAriane Trammell-Keller","2016","http://link.springer.com/chapter/10.1007/978-3-319-39675-0_10","Chapter"
"Narratives, Formalism, Computational Tools, and Nonlinearity","Language, Culture, Computation. Computing of the Humanities, Law, and Narratives","","","","10.1007/978-3-642-45324-3_11","Ephraim Nissan","2014","http://link.springer.com/chapter/10.1007/978-3-642-45324-3_11","Chapter"
"Bootstrapping an Online News Knowledge Base","Web Engineering","","","","10.1007/978-3-319-38791-8_37","Klesti HoxhaArtur BaxhakuIlia Ninka","2016","http://link.springer.com/chapter/10.1007/978-3-319-38791-8_37","Chapter"
"Notifications for Collaborative Documents Editing","Ubiquitous Computing and Ambient Intelligence. Personalisation and User Adapted Services","","","","10.1007/978-3-319-13102-3_16","Gustavo LópezLuis A. Guerrero","2014","http://link.springer.com/chapter/10.1007/978-3-319-13102-3_16","Chapter"
"Towards Liquid Web Applications","Engineering the Web in the Big Data Era","","","","10.1007/978-3-319-19890-3_10","Tommi MikkonenKari SystäCesare Pautasso","2015","http://link.springer.com/chapter/10.1007/978-3-319-19890-3_10","Chapter"
"Tangible Mixed Reality On-Site: Interactive Augmented Visualisations from Architectural Working Models in Urban Design","Computer-Aided Architectural Design Futures. The Next City - New Technologies and the Future of the Built Environment","","","","10.1007/978-3-662-47386-3_4","Gerhard SchubertDavid SchattelMarcus TönnisGudrun KlinkerFrank Petzold","2015","http://link.springer.com/chapter/10.1007/978-3-662-47386-3_4","Chapter"
"Design space exploration of hardware platforms for interactive low latency movement sonification","Journal on Multimodal User Interfaces","","10","1","10.1007/s12193-015-0199-y","Hans-Peter BrücknerSebastian LesseWolfgang TheimerHolger Blume","2016","http://link.springer.com/article/10.1007/s12193-015-0199-y","Article"
"Automated User Interaction Analysis for Workflow-Based Web Portals","Software Business. Towards Continuous Value Delivery","","","","10.1007/978-3-319-08738-2_11","Emil BacklundMikael BolleMatthias TichyHelena Holmström OlssonJan Bosch","2014","http://link.springer.com/chapter/10.1007/978-3-319-08738-2_11","Chapter"
"SnowWatch: A Multi-modal Citizen Science Application","Web Engineering","","","","10.1007/978-3-319-38791-8_43","Roman FedorovPiero FraternaliChiara Pasini","2016","http://link.springer.com/chapter/10.1007/978-3-319-38791-8_43","Chapter"
"A System Architecture for Affective Meta Intelligent Tutoring Systems","Intelligent Tutoring Systems","","","","10.1007/978-3-319-07221-0_67","Javier Gonzalez-SanchezMaria Elena Chavez-EcheagarayKurt VanLehnWinslow BurlesonSylvie GirardYoalli Hidalgo-PontetLishan Zhang","2014","http://link.springer.com/chapter/10.1007/978-3-319-07221-0_67","Chapter"
"Uniovi RoboCup Team Software Components for RoboCup@Home","International Technology Robotics Applications","","","","10.1007/978-3-319-02332-8_7","Ignacio GonzálezNatalia NavasLuis F. PérezJuan J. RomeroVíctor Sánchez","2014","http://link.springer.com/chapter/10.1007/978-3-319-02332-8_7","Chapter"
"Analysis Perspective Views of Grid Simulation Tools","Journal of Grid Computing","","13","2","10.1007/s10723-015-9328-9","Harshadkumar B. PrajapatiVipul A. Shah","2015","http://link.springer.com/article/10.1007/s10723-015-9328-9","Article"
"Structuring automotive product lines and feature models: an exploratory study at Opel","Requirements Engineering","","22","1","10.1007/s00766-015-0237-z","Olesia OliinykKai PetersenManfred SchoelzkeMartin BeckerSoeren Schneickert","2017","http://link.springer.com/article/10.1007/s00766-015-0237-z","Article"
"Scaling Agile Mechatronics: An Industrial Case Study","Continuous Software Engineering","","","","10.1007/978-3-319-11283-1_17","Jonn LantzUlf Eliasson","2014","http://link.springer.com/chapter/10.1007/978-3-319-11283-1_17","Chapter"
"Fostering Learning and Behavior Change Through Computer Entertainment","Entertaining the Whole World","","","","10.1007/978-1-4471-6446-3_4","Teresa Romão","2014","http://link.springer.com/chapter/10.1007/978-1-4471-6446-3_4","Chapter"
"Towards Rule-Based Dynamic Safety Monitoring for Mobile Robots","Simulation, Modeling, and Programming for Autonomous Robots","","","","10.1007/978-3-319-11900-7_18","Sorin AdamMorten LarsenKjeld JensenUlrik Pagh Schultz","2014","http://link.springer.com/chapter/10.1007/978-3-319-11900-7_18","Chapter"
"Hybrid Approach for Energy Aware Management of Multi-cloud Architecture Integrating user Machines","Journal of Grid Computing","","14","1","10.1007/s10723-015-9342-y","D. BorgettoR. ChakodeB. DepardonC. EichlerJ. M. GarciaH. HbaiebT. MonteilE. PelorceA. RachdiA. Al SheikhP. Stolf","2016","http://link.springer.com/article/10.1007/s10723-015-9342-y","Article"
"Formal Modelling of Distributed Automation CPS with CP-Agnostic Software","Service Orientation in Holonic and Multi-Agent Manufacturing","","","","10.1007/978-3-319-51100-9_4","Dmitrii DrozdovSandeep PatilValeriy Vyatkin","2017","http://link.springer.com/chapter/10.1007/978-3-319-51100-9_4","Chapter"
"Are Middlewares Ready for Multi-robots Systems?","Simulation, Modeling, and Programming for Autonomous Robots","","","","10.1007/978-3-319-11900-7_24","Stefan-Gabriel ChiticJulien PongeOlivier Simonin","2014","http://link.springer.com/chapter/10.1007/978-3-319-11900-7_24","Chapter"
"Upper Limb Robot Assisted Rehabilitation Platform Combining Virtual Reality, Posture Estimation and Kinematic Indices","Converging Clinical and Engineering Research on Neurorehabilitation II","","","","10.1007/978-3-319-46669-9_193","D. ScorzaA. de Los ReyesC. CortésA. ArdanzaA. BertelsenO. E. RuizA. GilJ. Flórez","2017","http://link.springer.com/chapter/10.1007/978-3-319-46669-9_193","Chapter"
"Innovative OER Model for Technology-Enhanced Academic and Entrepreneurial Learning","Open Education: from OERs to MOOCs","","","","10.1007/978-3-662-52925-6_17","Nenad StefanovicDanijela Milosevic","2017","http://link.springer.com/chapter/10.1007/978-3-662-52925-6_17","Chapter"
"Broken probes: toward the design of worn media","Personal and Ubiquitous Computing","","18","3","10.1007/s00779-013-0690-y","Miwa IkemiyaDaniela K. Rosner","2014","http://link.springer.com/article/10.1007/s00779-013-0690-y","Article"
"Redefining Game Engine Architecture Through Concurrency","Intelligent Software Methodologies, Tools and Techniques","","","","10.1007/978-3-319-17530-0_11","Ali MohebaliThiam Kian Chiew","2015","http://link.springer.com/chapter/10.1007/978-3-319-17530-0_11","Chapter"
"Elements of Adaptation in Ambient User Interfaces","Computers Helping People with Special Needs","","","","10.1007/978-3-319-41267-2_85","Laura BurzagliFabio GoriPaolo BarontiMarco BilliPier Luigi Emiliani","2016","http://link.springer.com/chapter/10.1007/978-3-319-41267-2_85","Chapter"
"Reactor protection system testing for the solid fuel thorium molten salt reactor","Nuclear Science and Techniques","","27","5","10.1007/s41365-016-0091-9","Zhen-Bao LiuYe LiuGui-Min LiuJie Hou","2016","http://link.springer.com/article/10.1007/s41365-016-0091-9","Article"
"Virtual Tailor for Garment Design","Virtual, Augmented and Mixed Reality","","","","10.1007/978-3-319-39907-2_62","Andrea VitaliLorenzo D’AmicoCaterina Rizzi","2016","http://link.springer.com/chapter/10.1007/978-3-319-39907-2_62","Chapter"
"Mobile Monitoring Review: Comparative with MoMo Framework Solution","Ambient Assisted Living. ICT-based Solutions in Real Life Situations","","","","10.1007/978-3-319-26410-3_21","Vladimir VillarrealRamón HervásJose Bravo","2015","http://link.springer.com/chapter/10.1007/978-3-319-26410-3_21","Chapter"
"RAMCIP: Towards a Robotic Assistant to Support Elderly with Mild Cognitive Impairments at Home","Pervasive Computing Paradigms for Mental Health","","","","10.1007/978-3-319-32270-4_19","Ioannis KostavelisDimitrios GiakoumisSotiris MalasiotisDimitrios Tzovaras","2016","http://link.springer.com/chapter/10.1007/978-3-319-32270-4_19","Chapter"
"PaSt: Human Tracking and Gestures Recognition for Flexible Virtual Environments Management","Augmented Reality, Virtual Reality, and Computer Graphics","","","","10.1007/978-3-319-40651-0_27","Dario Di MauroDavide Maria CalandraAntonio OrigliaFrancesco Cutugno","2016","http://link.springer.com/chapter/10.1007/978-3-319-40651-0_27","Chapter"
"Ontology-Based Modeling of Context-Aware Systems","Model-Driven Engineering Languages and Systems","","","","10.1007/978-3-319-11653-2_30","Daniel LüddeckeNina BergmannIna Schaefer","2014","http://link.springer.com/chapter/10.1007/978-3-319-11653-2_30","Chapter"
"Ontology Transformation of Enterprise Architecture Models","Technological Innovation for Collective Awareness Systems","","","","10.1007/978-3-642-54734-8_7","Marzieh BakhshadehAndré MoraisArtur CaetanoJosé Borbinha","2014","http://link.springer.com/chapter/10.1007/978-3-642-54734-8_7","Chapter"
"Industry Day Overview","Advances in Information Retrieval","","","","10.1007/978-3-319-30671-1_81","Omar AlonsoPavel Serdyukov","2016","http://link.springer.com/chapter/10.1007/978-3-319-30671-1_81","Chapter"
"Assessment of Agent Architectures for Telehealth","Highlights of Practical Applications of Heterogeneous Multi-Agent Systems. The PAAMS Collection","","","","10.1007/978-3-319-07767-3_8","Daniel JørgensenKasper HallenborgYves Demazeau","2014","http://link.springer.com/chapter/10.1007/978-3-319-07767-3_8","Chapter"
"Design and Verification Environment for High-Performance Video-Based Embedded Systems","Distributed Embedded Smart Cameras","","","","10.1007/978-1-4614-7705-1_4","Michael MefenzaFranck YongaChristophe Bobda","2014","http://link.springer.com/chapter/10.1007/978-1-4614-7705-1_4","Chapter"
"Using Bayesian networks for highly available cloud-based web applications","Journal of Reliable Intelligent Environments","","1","2 - 4","10.1007/s40860-015-0009-z","Stefano Marrone","2015","http://link.springer.com/article/10.1007/s40860-015-0009-z","Article"
"Liquid Stream Processing Across Web Browsers and Web Servers","Engineering the Web in the Big Data Era","","","","10.1007/978-3-319-19890-3_3","Masiar BabazadehAndrea GallidabinoCesare Pautasso","2015","http://link.springer.com/chapter/10.1007/978-3-319-19890-3_3","Chapter"
"Editorial for EAIT Issue 1, 2017","Education and Information Technologies","","22","1","10.1007/s10639-016-9570-1","Arthur Tatnall","2017","http://link.springer.com/article/10.1007/s10639-016-9570-1","Article"
"Towards Strategy Patterns for Evaluating Usability","Engineering the Web in the Big Data Era","","","","10.1007/978-3-319-19890-3_62","Belen RiveraPablo BeckerPhilip LewLuis Olsina","2015","http://link.springer.com/chapter/10.1007/978-3-319-19890-3_62","Chapter"
"Augmented Reality for Allowing Time Navigation in Cultural Tourism Experiences: A Case Study","Augmented and Virtual Reality","","","","10.1007/978-3-319-13969-2_22","Alessandro FioreLuca MainettiLuigi MancoPalmalisa Marra","2014","http://link.springer.com/chapter/10.1007/978-3-319-13969-2_22","Chapter"
"Enabling Co-Located Physical Social Play: A Framework for Design and Evaluation","Game User Experience Evaluation","","","","10.1007/978-3-319-15985-0_10","Elena Márquez SeguraKatherine Isbister","2015","http://link.springer.com/chapter/10.1007/978-3-319-15985-0_10","Chapter"
"A Virtual Reality Platform for Musical Creation: GENESIS-RT","Sound, Music, and Motion","","","","10.1007/978-3-319-12976-1_22","James LeonardClaude CadozNicolas CastagneJean-Loup FlorensAnnie Luciani","2014","http://link.springer.com/chapter/10.1007/978-3-319-12976-1_22","Chapter"
"Modular Development of Mobile Robots with Open Source Hardware and Software Components","RoboCup 2013: Robot World Cup XVII","","","","10.1007/978-3-662-44468-9_52","Martino MigliavaccaAndrea BonariniMatteo Matteucci","2014","http://link.springer.com/chapter/10.1007/978-3-662-44468-9_52","Chapter"
"Upgrade-E: A Rapid Prototyping Platform for Connected Powertrain Functions and Services","Energy Consumption and Autonomous Driving","","","","10.1007/978-3-319-19818-7_16","A. EngstleA. ZinklA. AngermaierW. Schelter","2016","http://link.springer.com/chapter/10.1007/978-3-319-19818-7_16","Chapter"
"An Integrated Autonomous Navigation and Decision-Making Architecture for Planetary Exploration Rovers","International Technology Robotics Applications","","","","10.1007/978-3-319-02332-8_10","A. MedinaG. BinetP. Colmenarejo","2014","http://link.springer.com/chapter/10.1007/978-3-319-02332-8_10","Chapter"
"Development and Production Processes for Secure Embedded Control Devices","Systems, Software and Services Process Improvement","","","","10.1007/978-3-319-44817-6_10","Tobias RauterAndrea HöllerJohannes IberChristian Kreiner","2016","http://link.springer.com/chapter/10.1007/978-3-319-44817-6_10","Chapter"
"Ubiquitous Intelligence and computing for enabling a smarter world","Personal and Ubiquitous Computing","","","","10.1007/s00779-017-1015-3","Diego López-de-IpiñaLiming ChenNathalie MittonGang Pan","2017","http://link.springer.com/article/10.1007/s00779-017-1015-3","Article"
"A Compact Walking Robot – Flexible Research and Development Platform","Recent Advances in Automation, Robotics and Measuring Techniques","","","","10.1007/978-3-319-05353-0_33","Dominik BelterKrzysztof Walas","2014","http://link.springer.com/chapter/10.1007/978-3-319-05353-0_33","Chapter"
"Smart Structure for Automated Rangoli","Emerging Research in Computing, Information, Communication and Applications","","","","10.1007/978-81-322-2550-8_54","Jit SenGuptaSuman Deb","2015","http://link.springer.com/chapter/10.1007/978-81-322-2550-8_54","Chapter"
"VASCO: Variability Specification in Business Process Models","Enterprise Information Systems","","","","10.1007/978-3-319-29133-8_30","Raoul Taffo TiamAbdelhak-Djamel SeriaiRaphael Michel","2015","http://link.springer.com/chapter/10.1007/978-3-319-29133-8_30","Chapter"
"JEMF: A Framework for the Development of Mobile Systems for Emergency Management","Collaboration and Technology","","","","10.1007/978-3-319-10166-8_21","Marcus F. T. MachadoBruno S. NascimentoAdriana S. VivacquaMarcos R. S. Borges","2014","http://link.springer.com/chapter/10.1007/978-3-319-10166-8_21","Chapter"
"Self-adaptive Hardware Acceleration on a Heterogeneous Cluster","Self-aware Computing Systems","","","","10.1007/978-3-319-39675-0_9","Xinyu NiuTim TodmanWayne Luk","2016","http://link.springer.com/chapter/10.1007/978-3-319-39675-0_9","Chapter"
"Computation in networks","Computational Cognitive Science","","1","1","10.1186/s40469-015-0003-z","James K Peterson","2015","http://link.springer.com/article/10.1186/s40469-015-0003-z","Article"
"Wildlife in the cloud: A new approach for engaging stakeholders in wildlife management","Ambio","","44","4","10.1007/s13280-015-0706-0","Guillaume Chapron","2015","http://link.springer.com/article/10.1007/s13280-015-0706-0","Article"
"Wireless home automation networks for indoor surveillance: technologies and experiments","EURASIP Journal on Wireless Communications and Networking","","2014","1","10.1186/1687-1499-2014-6","Milo SpadaciniStefano SavazziMonica Nicoli","2014","http://link.springer.com/article/10.1186/1687-1499-2014-6","Article"
"Linked Open Data and e-Participation in the EU Law-Making Process","Electronic Government and the Information Systems Perspective","","","","10.1007/978-3-319-44159-7_6","P. SchmitzE. FrancesconiB. BatoucheB. DombrovschiD. DuyS. P. LandercyV. Parisse","2016","http://link.springer.com/chapter/10.1007/978-3-319-44159-7_6","Chapter"
"An Agile Implementation within a Medical Device Software Organisation","Software Process Improvement and Capability Determination","","","","10.1007/978-3-319-13036-1_17","Martin McHughFergal McCafferyGarret Coady","2014","http://link.springer.com/chapter/10.1007/978-3-319-13036-1_17","Chapter"
"RoboCup SPL 2014 Champion Team Paper","RoboCup 2014: Robot World Cup XVIII","","","","10.1007/978-3-319-18615-3_6","Jayen AsharJaiden AshmoreBrad HallSean HarrisBernhard HengstRoger LiuZijie Mei (Jacky)Maurice PagnuccoRitwik RoyClaude SammutOleg SushkovBelinda TehLuke Tsekouras","2015","http://link.springer.com/chapter/10.1007/978-3-319-18615-3_6","Chapter"
"A Science Mapping Analysis of the Literature on Software Product Lines","Intelligent Software Methodologies, Tools and Techniques","","","","10.1007/978-3-319-22689-7_18","Ruben HeradioHector Perez-MoragoDavid Fernandez-AmorosFrancisco Javier CabrerizoEnrique Herrera-Viedma","2015","http://link.springer.com/chapter/10.1007/978-3-319-22689-7_18","Chapter"
"On Data Persistence Models for Mobile Crowdsensing Applications","Data Analytics and Management in Data Intensive Domains","","","","10.1007/978-3-319-57135-5_14","Dmitry NamiotManfred Sneps-Sneppe","2017","http://link.springer.com/chapter/10.1007/978-3-319-57135-5_14","Chapter"
"Incremental Speech Production for Polite and Natural Personal-Space Intrusion","Social Robotics","","","","10.1007/978-3-319-25554-5_8","Timo BaumannFelix Lindner","2015","http://link.springer.com/chapter/10.1007/978-3-319-25554-5_8","Chapter"
"Personalized Short-Term Multi-modal Interaction for Social Robots Assisting Users in Shopping Malls","Social Robotics","","","","10.1007/978-3-319-25554-5_27","Luca IocchiMaria Teresa LázaroLaurent JeanpierreAbdel-Illah Mouaddib","2015","http://link.springer.com/chapter/10.1007/978-3-319-25554-5_27","Chapter"
"Discrete classification technique applied to TV advertisements liking recognition system based on low-cost EEG headsets","BioMedical Engineering OnLine","","15","1","10.1186/s12938-016-0181-2","Luis M. Soria MorilloJuan A. Alvarez-GarciaLuis Gonzalez-AbrilJuan A. Ortega Ramírez","2016","http://link.springer.com/article/10.1186/s12938-016-0181-2","Article"
"ROBSNA: Social Robot for Interaction and Learning Therapies","Towards Autonomous Robotic Systems","","","","10.1007/978-3-662-43645-5_47","Paulina VélezKatherine GallegosJosé SilvaLuis TumalliCristian Vaca","2014","http://link.springer.com/chapter/10.1007/978-3-662-43645-5_47","Chapter"
"Monitoring Student Activities with a Querying System over Electronic Worksheets","Collaboration and Technology","","","","10.1007/978-3-319-10166-8_4","Nelson BaloianJose A. PinoJens HardingsHeinz Ulrich Hoppe","2014","http://link.springer.com/chapter/10.1007/978-3-319-10166-8_4","Chapter"
"Using the Bright Sparks Software Tool During Creative Design Work","Collaboration in Creative Design","","","","10.1007/978-3-319-29155-0_15","James LockerbieNeil Maiden","2016","http://link.springer.com/chapter/10.1007/978-3-319-29155-0_15","Chapter"
