Item Title,Publication Title,Book Series Title,Journal Volume,Journal Issue,Item DOI,Authors,Publication Year,URL,Content Type
"Adaptive Human-Machine-Interface of Automation Systems","Technological Innovation for Collective Awareness Systems","","","","10.1007/978-3-642-54734-8_20","Farzan Yazdi MotlaghPeter Göhner","2014","http://link.springer.com/chapter/10.1007/978-3-642-54734-8_20","Chapter"
"Software Architectures Supporting Human-Computer Interaction Analysis: A Literature Review","Learning and Collaboration Technologies","","","","10.1007/978-3-319-39483-1_12","Juan Cruz-BenitoRoberto TherónFrancisco J. García-Peñalvo","2016","http://link.springer.com/chapter/10.1007/978-3-319-39483-1_12","Chapter"
"Design and Evaluation of a Personalized Cancer Treatment System Using Human-Computer Interaction Techniques","New Advances in Information Systems and Technologies","","","","10.1007/978-3-319-31232-3_67","Alexandra MartinezRodrigo MoraGustavo LópezConstantino BolañosDaniel AlvaradoAndrés SolanoMariana LópezSteve QuirósAndrés Báez","2016","http://link.springer.com/chapter/10.1007/978-3-319-31232-3_67","Chapter"
"A human–computer interaction approach for healthcare","Universal Access in the Information Society","","","","10.1007/s10209-016-0515-7","Pere PonsaDaniel Guasch","2016","http://link.springer.com/article/10.1007/s10209-016-0515-7","Article"
"Biologically Inspired Artificial Endocrine System for Human Computer Interaction","Human-Computer Interaction: Design and Evaluation","","","","10.1007/978-3-319-20901-2_7","Hooman SamaniElham SaadatianBrian Jalaeian","2015","http://link.springer.com/chapter/10.1007/978-3-319-20901-2_7","Chapter"
"Retrospective and Future Automotive Infotainment Systems—100 Years of User Interface Evolution","Automotive User Interfaces","","","","10.1007/978-3-319-49448-7_1","Gerrit MeixnerCarina HäckerBjörn DeckerSimon GerlachAnne HessKonstantin HollAlexander KlausDaniel LüddeckeDaniel MauserMarius OrfgenMark PoguntkeNadine WalterRan Zhang","2017","http://link.springer.com/chapter/10.1007/978-3-319-49448-7_1","Chapter"
"Multimodal Systems: An Excursus of the Main Research Questions","On the Move to Meaningful Internet Systems: OTM 2015 Workshops","","","","10.1007/978-3-319-26138-6_59","Maria Chiara CascheraArianna D’UliziaFernando FerriPatrizia Grifoni","2015","http://link.springer.com/chapter/10.1007/978-3-319-26138-6_59","Chapter"
"Cultural User Experience in the Car—Toward a Standardized Systematic Intercultural Agile Automotive UI/UX Design Process","Automotive User Interfaces","","","","10.1007/978-3-319-49448-7_6","Rüdiger HeimgärtnerAlkesh SolankiHelmut Windl","2017","http://link.springer.com/chapter/10.1007/978-3-319-49448-7_6","Chapter"
"A formal model for plastic human computer interfaces","Frontiers of Computer Science","","","","10.1007/s11704-016-5460-3","Abdelkrim ChebiebYamine Ait Ameur","2017","http://link.springer.com/article/10.1007/s11704-016-5460-3","Article"
"Design Adaptable and Adaptive User Interfaces: A Method to Manage the Information","Ambient Assisted Living","","","","10.1007/978-3-319-18374-9_5","Francesca GullàSilvia CeccacciMichele GermaniLorenzo Cavalieri","2015","http://link.springer.com/chapter/10.1007/978-3-319-18374-9_5","Chapter"
"Invited Paper: Multimodal Interface for an Intelligent Wheelchair","Informatics in Control, Automation and Robotics","","","","10.1007/978-3-319-10891-9_1","Luís Paulo ReisBrígida Mónica FariaSérgio VasconcelosNuno Lau","2015","http://link.springer.com/chapter/10.1007/978-3-319-10891-9_1","Chapter"
"Semantic Web Reloaded: An Update on the Progress of Semantic Web technologies","KI - Künstliche Intelligenz","","30","2","10.1007/s13218-016-0433-0","Ubbo Visser","2016","http://link.springer.com/article/10.1007/s13218-016-0433-0","Article"
"Dealing with Faults During Operations: Beyond Classical Use of Formal Methods","The Handbook of Formal Methods in Human-Computer Interaction","","","","10.1007/978-3-319-51838-1_20","Camille FayollasPhilippe PalanqueJean-Charles FabreCélia MartinieYannick Déléris","2017","http://link.springer.com/chapter/10.1007/978-3-319-51838-1_20","Chapter"
"Complex Systems","Metasynthetic Computing and Engineering of Complex Systems","","","","10.1007/978-1-4471-6551-4_1","Longbing Cao","2015","http://link.springer.com/chapter/10.1007/978-1-4471-6551-4_1","Chapter"
"Education and CHI","HCI and User-Experience Design","","","","10.1007/978-1-4471-6744-0_22","Aaron Marcus","2015","http://link.springer.com/chapter/10.1007/978-1-4471-6744-0_22","Chapter"
"Online Psychometric Design (OnPsyD) Tool","Design, User Experience, and Usability. Theories, Methods, and Tools for Designing the User Experience","","","","10.1007/978-3-319-07668-3_38","Shiny VerghesePaul van SchaikSteve Green","2014","http://link.springer.com/chapter/10.1007/978-3-319-07668-3_38","Chapter"
"How to Achieve Design for All:","Universal Access in Human-Computer Interaction. Interaction Techniques and Environments","","","","10.1007/978-3-319-40244-4_12","Denis ChêneÉric PetitSophie Zijp-Rouzier","2016","http://link.springer.com/chapter/10.1007/978-3-319-40244-4_12","Chapter"
"A systematic review on multi-device inclusive environments","Universal Access in the Information Society","","15","4","10.1007/s10209-015-0422-3","Ig Ibert BittencourtMaria Cecília BaranauskasRoberto PereiraDiego DermevalSeiji IsotaniPatrícia Jaques","2016","http://link.springer.com/article/10.1007/s10209-015-0422-3","Article"
"Personalization in the Digital Era","Human-Centred Web Adaptation and Personalization","","","","10.1007/978-3-319-28050-9_1","Panagiotis GermanakosMarios Belk","2016","http://link.springer.com/chapter/10.1007/978-3-319-28050-9_1","Chapter"
"Evaluation of Industrial Touch Interfaces Using a Modular Software Architecture","Human-Computer Interaction. Theories, Methods, and Tools","","","","10.1007/978-3-319-07233-3_54","Philipp TiefenbacherFabian BumbergerGerhard Rigoll","2014","http://link.springer.com/chapter/10.1007/978-3-319-07233-3_54","Chapter"
"SCADA Applications for Electric Power System","Reactive Power Control in AC Power Systems","","","","10.1007/978-3-319-51118-4_15","Florentina Magda EnescuNicu Bizon","2017","http://link.springer.com/chapter/10.1007/978-3-319-51118-4_15","Chapter"
"Evaluation Based Graphical Controls: A Contribution to Mobile User Interface Early Evaluation","Human-Computer Interaction. Applications and Services","","","","10.1007/978-3-319-07227-2_12","Selem CharfiHoucine EzzedineChristophe Kolski","2014","http://link.springer.com/chapter/10.1007/978-3-319-07227-2_12","Chapter"
"Evaluation of Model-Based User Interface Development Approaches","Human-Computer Interaction. Theories, Methods, and Tools","","","","10.1007/978-3-319-07233-3_28","Jürgen EngelChristian HerdinChristian Märtin","2014","http://link.springer.com/chapter/10.1007/978-3-319-07233-3_28","Chapter"
"The Goals Approach: Enterprise Model-Driven Agile Human-Centered Software Engineering","Human-Centered and Error-Resilient Systems Development","","","","10.1007/978-3-319-44902-9_17","Pedro ValenteThiago Rocha SilvaMarco WincklerNuno Jardim Nunes","2016","http://link.springer.com/chapter/10.1007/978-3-319-44902-9_17","Chapter"
"Supporting the Design of AAL through a SW Integration Framework: The D4All Project","Universal Access in Human-Computer Interaction. Design and Development Methods for Universal Access","","","","10.1007/978-3-319-07437-5_8","Marco SaccoEnrico G. CaldarolaGianfranco ModoniWalter Terkaj","2014","http://link.springer.com/chapter/10.1007/978-3-319-07437-5_8","Chapter"
"An Assessment Framework for Usable-Security Based on Decision Science","Human Aspects of Information Security, Privacy, and Trust","","","","10.1007/978-3-319-07620-1_4","Yasser M. HausawiWilliam H. Allen","2014","http://link.springer.com/chapter/10.1007/978-3-319-07620-1_4","Chapter"
"Extracting and analyzing time-series HCI data from screen-captured task videos","Empirical Software Engineering","","22","1","10.1007/s10664-015-9417-1","Lingfeng BaoJing LiZhenchang XingXinyu WangXin XiaBo Zhou","2017","http://link.springer.com/article/10.1007/s10664-015-9417-1","Article"
"Adding Usability Quality Attributes into Interactive Systems Architecture: A Pattern-Based Approach","Patterns of HCI Design and HCI Design of Patterns","","","","10.1007/978-3-319-15687-3_4","Ahmed Seffah","2015","http://link.springer.com/chapter/10.1007/978-3-319-15687-3_4","Chapter"
"Multimodal Serious Games Technologies for Cultural Heritage","Mixed Reality and Gamification for Cultural Heritage","","","","10.1007/978-3-319-49607-8_15","Fotis LiarokapisPanagiotis PetridisDaniel AndrewsSara de Freitas","2017","http://link.springer.com/chapter/10.1007/978-3-319-49607-8_15","Chapter"
"Designing Responsive Interactive Applications by Emotion-Tracking and Pattern-Based Dynamic User Interface Adaptation","Human-Computer Interaction. Novel User Experiences","","","","10.1007/978-3-319-39513-5_3","Christian MärtinSanim RashidChristian Herdin","2016","http://link.springer.com/chapter/10.1007/978-3-319-39513-5_3","Chapter"
"Requirements for the Successful Market Adoption of Adaptive User Interfaces for Accessibility","Universal Access in Human-Computer Interaction. Design for All and Accessibility Practice","","","","10.1007/978-3-319-07509-9_41","Matthias PeissnerAndreas SchullerDaniel ZieglerChristian KnechtGottfried Zimmermann","2014","http://link.springer.com/chapter/10.1007/978-3-319-07509-9_41","Chapter"
"HCI Requirements for Young Primary School CALL Learners","Learning and Collaboration Technologies. Technology-Rich Environments for Learning and Collaboration","","","","10.1007/978-3-319-07485-6_34","Monica Ward","2014","http://link.springer.com/chapter/10.1007/978-3-319-07485-6_34","Chapter"
"The Goals Approach: Agile Enterprise Driven Software Development","Complexity in Information Systems Development","","","","10.1007/978-3-319-52593-8_13","Pedro ValenteThiago SilvaMarco WincklerNuno Nunes","2017","http://link.springer.com/chapter/10.1007/978-3-319-52593-8_13","Chapter"
"The Insight–Prototype–Product Cycle Best Practices and Processes to Iteratively Advance In-Vehicle Interactive Experiences Development","Automotive User Interfaces","","","","10.1007/978-3-319-49448-7_14","Ignacio AlvarezAdam JordanJuliana KnopfDarrell LeBlancLaura RumbelAlexandra Zafiroglu","2017","http://link.springer.com/chapter/10.1007/978-3-319-49448-7_14","Chapter"
"Human Factors in Software Development Processes: Measuring System Quality","Product-Focused Software Process Improvement","","","","10.1007/978-3-319-49094-6_57","Silvia AbrahaoMaria Teresa BaldassarreDanilo CaivanoYvonne DittrichRosa LanzilottiAntonio Piccinno","2016","http://link.springer.com/chapter/10.1007/978-3-319-49094-6_57","Chapter"
"Building Mobile Software Ecosystems - A Practical Approach","Human-Computer Interaction: Users and Contexts","","","","10.1007/978-3-319-21006-3_17","Steffen HessSusanne BraunJohannes FeldhausMarco HackFelix KieferDominik MaginMatthias NaabDominik RichterTorsten LenhartMarcus Trapp","2015","http://link.springer.com/chapter/10.1007/978-3-319-21006-3_17","Chapter"
"Design Requirements to Integrate Eye Trackers in Simulation Environments: Aeronautical Use Case","Intelligent Decision Technologies","","","","10.1007/978-3-319-19857-6_21","Jean-Paul ImbertChristophe HurterVsevolod PeysakhovichColin BlättlerFrédéric DehaisCyril Camachon","2015","http://link.springer.com/chapter/10.1007/978-3-319-19857-6_21","Chapter"
"Early Prototyping of 3D-Gesture Interaction within the Presentation-Gesture-Dialog Design Space","Human-Computer Interaction. Advanced Interaction Modalities and Techniques","","","","10.1007/978-3-319-07230-2_2","Birgit BomsdorfRainer Blum","2014","http://link.springer.com/chapter/10.1007/978-3-319-07230-2_2","Chapter"
"Extending OpenUP to Conform with the ISO Usability Maturity Model","Human-Centered Software Engineering","","","","10.1007/978-3-662-44811-3_6","Andrés Rodríguez","2014","http://link.springer.com/chapter/10.1007/978-3-662-44811-3_6","Chapter"
"Engineering Variance: Software Techniques for Scalable, Customizable, and Reusable Multimodal Processing","Human-Computer Interaction. Theories, Methods, and Tools","","","","10.1007/978-3-319-07233-3_29","Marc Erich LatoschikMartin Fischbach","2014","http://link.springer.com/chapter/10.1007/978-3-319-07233-3_29","Chapter"
"Ontology-Based Adaptive Interfaces for Colorblind Users","Universal Access in Human-Computer Interaction. Methods, Techniques, and Best Practices","","","","10.1007/978-3-319-40250-5_3","Ricardo José de AraújoJulio Cesar Dos ReisRodrigo Bonacin","2016","http://link.springer.com/chapter/10.1007/978-3-319-40250-5_3","Chapter"
"FRAMES – A Framework for Adaptable Mobile Event-Contingent Self-report Studies","End-User Development","","","","10.1007/978-3-319-18425-8_10","Julian DaxThomas LudwigJohanna MeurerVolkmar PipekMartin SteinGunnar Stevens","2015","http://link.springer.com/chapter/10.1007/978-3-319-18425-8_10","Chapter"
"Literature Review: ICT, SDPs and System Design for User Needs","Design Issues for Service Delivery Platforms","","","","10.1007/978-3-658-10541-9_2","Dr. Martin Bergaus","2015","http://link.springer.com/chapter/10.1007/978-3-658-10541-9_2","Chapter"
"Software Architecture with Flexibility for the Data-Intensive Fish4Knowledge Project","Fish4Knowledge: Collecting and Analyzing Massive Coral Reef Fish Video Data","","","","10.1007/978-3-319-30208-9_6","Bastiaan J. Boom","2016","http://link.springer.com/chapter/10.1007/978-3-319-30208-9_6","Chapter"
"Exploring Quality-Aware Architectural Transformations at Run-Time: The ENIA Case","Model and Data Engineering","","","","10.1007/978-3-319-45547-1_23","Javier CriadoSilverio Martínez-FernándezDavid AmellerLuis IribarneNicolás Padilla","2016","http://link.springer.com/chapter/10.1007/978-3-319-45547-1_23","Chapter"
"A Haptic Knob as an Innovative User Interface for Visually-Impaired","Universal Access in Human-Computer Interaction. Access to Interaction","","","","10.1007/978-3-319-20681-3_12","Maura MengoniLorenzo CavalieriDamiano Raponi","2015","http://link.springer.com/chapter/10.1007/978-3-319-20681-3_12","Chapter"
"POMA: Pattern-Oriented and Model-Driven Architecture","Patterns of HCI Design and HCI Design of Patterns","","","","10.1007/978-3-319-15687-3_8","Ahmed Seffah","2015","http://link.springer.com/chapter/10.1007/978-3-319-15687-3_8","Chapter"
"Stress Game: The Role of Motivational Robotic Assistance in Reducing User’s Task Stress","International Journal of Social Robotics","","7","2","10.1007/s12369-014-0256-9","Thi-Hai-Ha DangAdriana Tapus","2015","http://link.springer.com/article/10.1007/s12369-014-0256-9","Article"
"Accessible user interface support for multi-device ubiquitous applications: architectural modifiability considerations","Universal Access in the Information Society","","15","1","10.1007/s10209-014-0373-0","Heiko DesruelleSimon IsenbergAndreas BotsikasPaolo VergoriFrank Gielen","2016","http://link.springer.com/article/10.1007/s10209-014-0373-0","Article"
"Human-Robot Social Interaction","Sociorobot World","","","","10.1007/978-3-319-21422-1_4","Spyros G. Tzafestas","2016","http://link.springer.com/chapter/10.1007/978-3-319-21422-1_4","Chapter"
"Multimodal interaction with virtual worlds XMMVR: eXtensible language for MultiModal interaction with virtual reality worlds","Journal on Multimodal User Interfaces","","9","3","10.1007/s12193-015-0176-5","Hector OlmedoDavid EscuderoValentín Cardeñoso","2015","http://link.springer.com/article/10.1007/s12193-015-0176-5","Article"
"Guidelines for the Gamification in Mobile Social Networks","Social Computing and Social Media","","","","10.1007/978-3-319-07632-4_53","Fábio Pereira AlvesCristiano MacielJúnia Coutinho Anacleto","2014","http://link.springer.com/chapter/10.1007/978-3-319-07632-4_53","Chapter"
"Spyractable: A Tangible User Interface Modular Synthesizer","Human-Computer Interaction. Advanced Interaction Modalities and Techniques","","","","10.1007/978-3-319-07230-2_57","Spyridon PotidisThomas Spyrou","2014","http://link.springer.com/chapter/10.1007/978-3-319-07230-2_57","Chapter"
"Addressing the Users’ Diversity in Ubiquitous Environments through a Low Cost Architecture","Universal Access in Human-Computer Interaction. Aging and Assistive Environments","","","","10.1007/978-3-319-07446-7_43","Tatiana Silva de AlencarLuciano Rodrigues MachadoLuciano de Oliveira NerisVânia Paula de Almeida Neris","2014","http://link.springer.com/chapter/10.1007/978-3-319-07446-7_43","Chapter"
"TActile Glasses (TAG) for Obstacle Avoidance","Universal Access in Human-Computer Interaction. Aging and Assistive Environments","","","","10.1007/978-3-319-07446-7_70","Georgios KorresAhmad El IssawiMohamad Eid","2014","http://link.springer.com/chapter/10.1007/978-3-319-07446-7_70","Chapter"
"The Design and Development of Empathetic Serious Games for Dyslexia: BCI Arabic Phonological Processing Training Systems","Design, User Experience, and Usability. User Experience Design Practice","","","","10.1007/978-3-319-07638-6_11","Arwa Al-RubaianLama AlssumRawan AlharbiWafa AlrajhiHaifa AldayelNora AlangariHadeel Al-NegheimishAljohara AlfayezSara AlwaalanRania AljindanAshwag AlshathriDania AlomarGhada AlhudhudAreej Al-Wabil","2014","http://link.springer.com/chapter/10.1007/978-3-319-07638-6_11","Chapter"
"The igus Humanoid Open Platform","KI - Künstliche Intelligenz","","30","3 - 4","10.1007/s13218-016-0448-6","Philipp AllgeuerHafez FaraziGrzegorz FichtMichael SchreiberSven Behnke","2016","http://link.springer.com/article/10.1007/s13218-016-0448-6","Article"
"2D Hand Gesture for Numeric Devnagari Sign Language Analyzer Based on Two Cameras","Intelligent Human Computer Interaction","","","","10.1007/978-3-319-52503-7_12","Jayshree PansareMaya Ingle","2017","http://link.springer.com/chapter/10.1007/978-3-319-52503-7_12","Chapter"
"User Interaction Concepts in Smart Caring Homes for Elderly with Chronic Conditions","Inclusive Smart Cities and e-Health","","","","10.1007/978-3-319-19312-0_4","Cristian-Dan BaraMiriam CabritaHarm op den AkkerHermie J. Hermens","2015","http://link.springer.com/chapter/10.1007/978-3-319-19312-0_4","Chapter"
"Interaction and Humans in Internet of Things","Human-Computer Interaction – INTERACT 2015","","","","10.1007/978-3-319-22723-8_80","Markku TurunenDaniel SonntagKlaus-Peter EngelbrechtThomas OlssonDirk Schnelle-WalkaAndrés Lucero","2015","http://link.springer.com/chapter/10.1007/978-3-319-22723-8_80","Chapter"
"eCITY: Evolutionary Software Architecture Visualization – An Evaluation","Building Bridges: HCI, Visualization, and Non-formal Modeling","","","","10.1007/978-3-642-54894-9_15","Taimur KhanHenning BarthelLiliana GuzmanAchim EbertPeter Liggesmeyer","2014","http://link.springer.com/chapter/10.1007/978-3-642-54894-9_15","Chapter"
"Exploring Challenging Environments: Contextual Research in the Car and the Factory Through an HCI Lens","Designing Socially Embedded Technologies in the Real-World","","","","10.1007/978-1-4471-6720-4_12","Astrid WeissAlexander MeschtscherjakovRoland BuchnerEwald StrasserPatricia M. KlucknerSebastian OsswaldNicole MirnigDavid WilfingerNicole PertererPetra SundstroemArno LamingerManfred Tscheligi","2015","http://link.springer.com/chapter/10.1007/978-1-4471-6720-4_12","Chapter"
"A Typed Approach to User Interaction Modelling","Hagenberg Business Process Modelling Method","","","","10.1007/978-3-319-30496-0_4","Felix KossakChrista IllibauerVerena GeistChristine NatschlägerThomas ZiebermayrBernhard FreudenthalerTheodorich KopetzkyKlaus-Dieter Schewe","2016","http://link.springer.com/chapter/10.1007/978-3-319-30496-0_4","Chapter"
"“KogniChef”: A Cognitive Cooking Assistant","KI - Künstliche Intelligenz","","","","10.1007/s13218-017-0488-6","Alexander NeumannChristof ElbrechterNadine Pfeiffer-LeßmannRisto KõivaBirte CarlmeyerStefan RütherMichael SchadeAndré ÜckermannSven WachsmuthHelge J. Ritter","2017","http://link.springer.com/article/10.1007/s13218-017-0488-6","Article"
"Mediating Asymmetries in Family Communication: Supporting the eInclusion of Older Adults","Universal Access in Human-Computer Interaction.   Access to Today's Technologies","","","","10.1007/978-3-319-20678-3_42","Francisco J. GutierrezSergio F. OchoaJulita Vassileva","2015","http://link.springer.com/chapter/10.1007/978-3-319-20678-3_42","Chapter"
"The Innovation Binder Approach: A Guide Towards a Social-Technical Balanced Pervasive Health System","Pervasive Health","","","","10.1007/978-1-4471-6413-5_4","A. JacobsP. DuysburghL. BleumersF. OngenaeA. AckaertS. Verstichel","2014","http://link.springer.com/chapter/10.1007/978-1-4471-6413-5_4","Chapter"
"POP: An Instrument to Decide on the Adoption of Participatory Design","Human-Computer Interaction. Theory, Design, Development and Practice","","","","10.1007/978-3-319-39510-4_14","Helder Cognaco de OliveiraMarcelo da Silva HounsellIsabela Gasparini","2016","http://link.springer.com/chapter/10.1007/978-3-319-39510-4_14","Chapter"
"Rapid Prototyping for Mobile Serious Games","Learning and Collaboration Technologies. Technology-Rich Environments for Learning and Collaboration","","","","10.1007/978-3-319-07485-6_20","José RouillardAudrey SernaBertrand DavidRené Chalon","2014","http://link.springer.com/chapter/10.1007/978-3-319-07485-6_20","Chapter"
"Cognitive Computing: Where Big Data Is Driving Us","Handbook of Big Data Technologies","","","","10.1007/978-3-319-49340-4_24","Ana Paula AppelHeloisa CandelloFábio Latuf Gandour","2017","http://link.springer.com/chapter/10.1007/978-3-319-49340-4_24","Chapter"
"Introduction to Cyber-Physical Systems","Guide to Computing Fundamentals in Cyber-Physical Systems","","","","10.1007/978-3-319-25178-3_3","Dietmar P. F. Möller","2016","http://link.springer.com/chapter/10.1007/978-3-319-25178-3_3","Chapter"
"A Real-Time Gesture-Based Unmanned Aerial Vehicle Control System","Advances in Multimedia Information Processing - PCM 2016","","","","10.1007/978-3-319-48890-5_52","Leye WeiXin JinZhiyong WuLei Zhang","2016","http://link.springer.com/chapter/10.1007/978-3-319-48890-5_52","Chapter"
"A Symbolic Approach to Self-optimisation in Production System Analysis and Control","Advances in Production Technology","","","","10.1007/978-3-319-12304-2_11","Christopher M. SchlickMarco FaberSinem KuzJennifer Bützler","2015","http://link.springer.com/chapter/10.1007/978-3-319-12304-2_11","Chapter"
"Information Technologies as Tools for Studying Complex Processes","Topical Directions of Informatics","","","","10.1007/978-1-4939-0476-1_3","Ivan V. Sergienko","2014","http://link.springer.com/chapter/10.1007/978-1-4939-0476-1_3","Chapter"
"Bridging User Context and Design Models to Build Adaptive User Interfaces","Human-Centered Software Engineering","","","","10.1007/978-3-662-44811-3_3","Mladjan JovanovicDusan StarcevicZoran Jovanovic","2014","http://link.springer.com/chapter/10.1007/978-3-662-44811-3_3","Chapter"
"A Survey of Autonomous Human Affect Detection Methods for Social Robots Engaged in Natural HRI","Journal of Intelligent & Robotic Systems","","82","1","10.1007/s10846-015-0259-2","Derek McCollAlexander HongNaoaki HatakeyamaGoldie NejatBeno Benhabib","2016","http://link.springer.com/article/10.1007/s10846-015-0259-2","Article"
"Enhancing Students’ Motivation to Learn Software Engineering Programming Techniques: A Collaborative and Social Interaction Approach","Universal Access in Human-Computer Interaction. Access to Learning, Health and Well-Being","","","","10.1007/978-3-319-20684-4_19","Ricardo Rodrigues NunesDaniela PedrosaBenjamim FonsecaHugo ParedesJosé CravinoLeonel MorgadoPaulo Martins","2015","http://link.springer.com/chapter/10.1007/978-3-319-20684-4_19","Chapter"
"The DHU-SAM: Modeling MIS Software Architecture","Proceedings of International Conference on Computer Science and Information Technology","","","","10.1007/978-81-322-1759-6_94","Mingyou YingMin XieQiong WuZehui ChenJingxian Chen","2014","http://link.springer.com/chapter/10.1007/978-81-322-1759-6_94","Chapter"
"Developing an Ecosystem for Interactive Electronic Implants","Biomimetic and Biohybrid Systems","","","","10.1007/978-3-319-42417-0_56","Paul StrohmeierCedric HonnetSamppa von Cyborg","2016","http://link.springer.com/chapter/10.1007/978-3-319-42417-0_56","Chapter"
"Induction Machine Faults Leading to Occupational Accidents","Universal Access in Human-Computer Interaction. Design for All and Accessibility Practice","","","","10.1007/978-3-319-07509-9_23","Beata Mrugalska","2014","http://link.springer.com/chapter/10.1007/978-3-319-07509-9_23","Chapter"
"A Software Architecture Centric Engineering Approach for Internetware","Internetware","","","","10.1007/978-981-10-2546-4_11","Hong MeiJian Lü","2016","http://link.springer.com/chapter/10.1007/978-981-10-2546-4_11","Chapter"
"Introduction to the GI-Dagstuhl Book on Entertainment Computing and Serious Games","Entertainment Computing and Serious Games","","","","10.1007/978-3-319-46152-6_1","Ralf DörnerStefan GöbelMichael Kickmeier-Rust","2016","http://link.springer.com/chapter/10.1007/978-3-319-46152-6_1","Chapter"
"Incorporating Usability into Model Transformation","Human-Computer Systems Interaction: Backgrounds and Applications 3","","","","10.1007/978-3-319-08491-6_3","L. B. AmmarA. TrabelsiA. Mahfoudhi","2014","http://link.springer.com/chapter/10.1007/978-3-319-08491-6_3","Chapter"
"Supporting Peer Help in Collaborative Learning Environments: A Discussion Based on Two Case Studies","On the Move to Meaningful Internet Systems: OTM 2015 Conferences","","","","10.1007/978-3-319-26148-5_5","Luana MüllerLetícia Lopes LeiteMilene Selbach Silveira","2015","http://link.springer.com/chapter/10.1007/978-3-319-26148-5_5","Chapter"
